https://www.nhatot.com/mua-ban-nha-dat-quan-hai-ba-trung-ha-noi/120668784.htm,"Phố Dương Văn Bé, Phường Vĩnh Tuy, Quận Hai Bà Trưng, Hà Nội","5,1 tỷ","159,38 triệu/m²",5 phòng,4 phòng,5,Đã có sổ,"Nhà ngõ, hẻm",5 m,,,32 m²,,Nội thất đầy đủ
https://www.nhatot.com/mua-ban-nha-dat-quan-hoang-mai-ha-noi/120668699.htm,"Phố Vĩnh Hưng, Phường Vĩnh Hưng, Quận Hoàng Mai, Hà Nội","5,1 tỷ","159,38 triệu/m²",3 phòng,4 phòng,5,Đã có sổ,"Nhà ngõ, hẻm",5 m,7 m,,32 m²,,Nội thất đầy đủ
https://www.nhatot.com/mua-ban-nha-dat-quan-dong-da-ha-noi/120668591.htm,"Đường Nguyễn Chí Thanh, Phường Láng Thượng, Quận Đống Đa, Hà Nội",13 tỷ,"270,83 triệu/m²",4 phòng,,,Đã có sổ,"Nhà ngõ, hẻm",,,,48 m²,,
https://www.nhatot.com/mua-ban-nha-dat-quan-hoang-mai-ha-noi/120668531.htm,"Phố Nam Dư, Phường Lĩnh Nam, Quận Hoàng Mai, Hà Nội","5,6 tỷ","147,37 triệu/m²",3 phòng,,,Đã có sổ,"Nhà ngõ, hẻm",,,,38 m²,,
https://www.nhatot.com/mua-ban-nha-dat-huyen-hoai-duc-ha-noi/120668525.htm,Đường Vạn Xuân,"4,93 tỷ",145 triệu/m²,3 phòng,,5,Đã có sổ,"Nhà ngõ, hẻm",4.4 m,,34 m²,34 m²,,
https://www.nhatot.com/mua-ban-nha-dat-quan-dong-da-ha-noi/119513162.htm,"Phố Xã Đàn, Phường Nam Đồng, Quận Đống Đa, Hà Nội","7,5 tỷ","136,36 triệu/m²",3 phòng,,,Đã có sổ,"Nhà ngõ, hẻm",,,,55 m²,,
https://www.nhatot.com/mua-ban-nha-dat-quan-ha-dong-ha-noi/120668437.htm#px=SR-special_display_ad-[PO-17][PL-default],"Phố Phú Lương, Phường Phú Lương, Quận Hà Đông, Hà Nội","6,35 tỷ","154,88 triệu/m²",6 phòng,,4,Đã có sổ,"Nhà ngõ, hẻm",,,,41 m²,,
https://www.nhatot.com/mua-ban-nha-dat-quan-long-bien-ha-noi/120384861.htm,"Phố Ngọc Lâm, Phường Ngọc Lâm, Quận Long Biên, Hà Nội","13,7 tỷ","297,83 triệu/m²",4 phòng,,4,Đã có sổ,"Nhà ngõ, hẻm",,,,46 m²,,
https://www.nhatot.com/mua-ban-nha-dat-quan-hoan-kiem-ha-noi/120668315.htm#px=SR-special_display_ad-[PO-19][PL-default],"Phố Hàng Cân, Phường Hàng Đào, Quận Hoàn Kiếm, Hà Nội",130 tỷ,"742,86 triệu/m²",nhiều hơn 10 phòng,Nhiều hơn 6 phòng,4,Đã có sổ,"Nhà mặt phố, mặt tiền",8.8 m,,400 m²,175 m²,,Nội thất đầy đủ
https://www.nhatot.com/mua-ban-nha-dat-quan-cau-giay-ha-noi/120668237.htm,"Phố Quan Hoa, Phường Quan Hoa, Quận Cầu Giấy, Hà Nội",5 tỷ,"192,31 triệu/m²",2 phòng,4 phòng,5,Đã có sổ,"Nhà ngõ, hẻm",,,26 m²,26 m²,,Hoàn thiện cơ bản
https://www.nhatot.com/mua-ban-nha-dat-quan-cau-giay-ha-noi/120668237.htm,"Phố Quan Hoa, Phường Quan Hoa, Quận Cầu Giấy, Hà Nội",5 tỷ,"192,31 triệu/m²",2 phòng,4 phòng,5,Đã có sổ,"Nhà ngõ, hẻm",,,26 m²,26 m²,,Hoàn thiện cơ bản
https://www.nhatot.com/mua-ban-nha-dat-quan-long-bien-ha-noi/120668217.htm,"Thống Nhất, Phường Cự Khối, Quận Long Biên, Hà Nội","4,2 tỷ","64,62 triệu/m²",3 phòng,2 phòng,2,Đã có sổ,"Nhà ngõ, hẻm",4.9 m,15 m,130 m²,65 m²,Đông Nam,Nội thất đầy đủ
https://www.nhatot.com/mua-ban-nha-dat-quan-hai-ba-trung-ha-noi/120668201.htm,"Tô Hiến Thành, Phường Bùi Thị Xuân, Quận Hai Bà Trưng, Hà Nội",155 tỷ,"704,55 triệu/m²",10 phòng,Nhiều hơn 6 phòng,10,Đã có sổ,"Nhà mặt phố, mặt tiền",9 m,,2200 m²,220 m²,,Nội thất đầy đủ
https://www.nhatot.com/mua-ban-nha-dat-quan-cau-giay-ha-noi/120668140.htm,"Đường Hoàng Quốc Việt, Phường Nghĩa Đô, Quận Cầu Giấy, Hà Nội",129 tỷ,"806,25 triệu/m²",6 phòng,6 phòng,6,Đã có sổ,"Nhà mặt phố, mặt tiền",10 m,,1000 m²,160 m²,,Nội thất đầy đủ
https://www.nhatot.com/mua-ban-nha-dat-quan-ha-dong-ha-noi/119827642.htm,"Đa Sĩ, Phường Kiến Hưng, Quận Hà Đông, Hà Nội",6 tỷ,"157,89 triệu/m²",4 phòng,3 phòng,4,Đã có sổ,"Nhà ngõ, hẻm",,,,38 m²,,Nội thất đầy đủ
https://www.nhatot.com/mua-ban-nha-dat-quan-dong-da-ha-noi/120667997.htm,"Đường Linh Quang, Phường Văn Chương, Quận Đống Đa, Hà Nội","2,58 tỷ",172 triệu/m²,3 phòng,3 phòng,4,Đã có sổ,"Nhà ngõ, hẻm",3.2 m,,,15 m²,,Hoàn thiện cơ bản
https://www.nhatot.com/mua-ban-nha-dat-quan-nam-tu-liem-ha-noi/120667998.htm,"Phố Nguyễn Hoàng, Phường Mỹ Đình 2, Quận Nam Từ Liêm, Hà Nội","44,68 tỷ","638,29 triệu/m²",7 phòng,Nhiều hơn 6 phòng,8,Đã có sổ,"Nhà mặt phố, mặt tiền",5 m,,560 m²,70 m²,,Nội thất cao cấp
https://www.nhatot.com/mua-ban-nha-dat-quan-bac-tu-liem-ha-noi/120277467.htm,"Đường Xuân Đỉnh, Phường Xuân Đỉnh, Quận Bắc Từ Liêm, Hà Nội",12 tỷ,150 triệu/m²,nhiều hơn 10 phòng,,7,Đã có sổ,"Nhà ngõ, hẻm",,,,80 m²,,Nội thất đầy đủ
https://www.nhatot.com/mua-ban-nha-dat-quan-dong-da-ha-noi/119932735.htm,"Xã Đàn, Phường Ô Chợ Dừa, Quận Đống Đa, Hà Nội","11,5 tỷ","255,56 triệu/m²",4 phòng,4 phòng,5,Đã có sổ,"Nhà mặt phố, mặt tiền",,,45 m²,45 m²,,Nội thất cao cấp
https://www.nhatot.com/mua-ban-nha-dat-quan-ha-dong-ha-noi/120667725.htm,"Đường Thanh Bình, Phường Mộ Lao, Quận Hà Đông, Hà Nội","7,9 tỷ",158 triệu/m²,3 phòng,3 phòng,5,Đã có sổ,"Nhà mặt phố, mặt tiền",5 m,10 m,50 m²,50 m²,,Nội thất đầy đủ
https://www.nhatot.com/mua-ban-nha-dat-quan-ha-dong-ha-noi/120451667.htm,"Phố Ngô Thì Nhậm, Phường Hà Cầu, Quận Hà Đông, Hà Nội","10,35 tỷ",207 triệu/m²,3 phòng,2 phòng,3,Đã có sổ,Nhà phố liền kề,6.3 m,,50 m²,50 m²,,Nội thất đầy đủ
https://www.nhatot.com/mua-ban-nha-dat-quan-ha-dong-ha-noi/120667550.htm,"Phố Phan Đình Giót, Phường La Khê, Quận Hà Đông, Hà Nội",6 tỷ,200 triệu/m²,3 phòng,4 phòng,5,Đã có sổ,"Nhà ngõ, hẻm",3.5 m,9 m,30 m²,30 m²,,Nội thất đầy đủ
https://www.nhatot.com/mua-ban-nha-dat-quan-tay-ho-ha-noi/120667540.htm,"Phố Trịnh Công Sơn, Phường Nhật Tân, Quận Tây Hồ, Hà Nội","8,6 tỷ",215 triệu/m²,4 phòng,,,Đã có sổ,"Nhà ngõ, hẻm",,,,40 m²,,
https://www.nhatot.com/mua-ban-nha-dat-quan-hai-ba-trung-ha-noi/120667497.htm,"Phố Minh Khai, Phường Minh Khai, Quận Hai Bà Trưng, Hà Nội","11,9 tỷ","264,44 triệu/m²",3 phòng,,,Đã có sổ,"Nhà ngõ, hẻm",,,,45 m²,,
https://www.nhatot.com/mua-ban-nha-dat-quan-cau-giay-ha-noi/113305402.htm,"Mai Dịch, Phường Mai Dịch, Quận Cầu Giấy, Hà Nội",15 tỷ,"214,29 triệu/m²",5 phòng,,,,Nhà phố liền kề,,,,70 m²,,
https://www.nhatot.com/mua-ban-nha-dat-quan-tay-ho-ha-noi/120667352.htm,"Phố An Dương, Phường Yên Phụ, Quận Tây Hồ, Hà Nội","6,2 tỷ","182,35 triệu/m²",3 phòng,4 phòng,5,Đã có sổ,"Nhà ngõ, hẻm",3.4 m,10 m,34 m²,34 m²,,Nội thất cao cấp
https://www.nhatot.com/mua-ban-nha-dat-quan-ha-dong-ha-noi/120667336.htm,"Đường Đa Sỹ, Phường Kiến Hưng, Quận Hà Đông, Hà Nội","7,06 tỷ","205,83 triệu/m²",6 phòng,,,Đã có sổ,"Nhà mặt phố, mặt tiền",,,,34.3 m²,,
https://www.nhatot.com/mua-ban-nha-dat-quan-hoang-mai-ha-noi/120667298.htm,"Đường Hoàng Mai, Phường Mai Động, Quận Hoàng Mai, Hà Nội","4,5 tỷ","112,50 triệu/m²",3 phòng,4 phòng,5,Đã có sổ,"Nhà ngõ, hẻm",,,,40 m²,,Nội thất đầy đủ
https://www.nhatot.com/mua-ban-nha-dat-quan-ba-dinh-ha-noi/120667283.htm,"Đường Văn Cao, Phường Liễu Giai, Quận Ba Đình, Hà Nội","6,8 tỷ","194,29 triệu/m²",2 phòng,3 phòng,4,Đã có sổ,"Nhà ngõ, hẻm",4 m,8 m,35 m²,35 m²,,Nội thất cao cấp
https://www.nhatot.com/mua-ban-nha-dat-quan-ha-dong-ha-noi/119971574.htm,"Mậu Lương, Phường La Khê, Quận Hà Đông, Hà Nội","4,98 tỷ","160,65 triệu/m²",3 phòng,4 phòng,,Đã có sổ,"Nhà ngõ, hẻm",,,35 m²,31 m²,,Nội thất cao cấp
https://www.nhatot.com/mua-ban-nha-dat-quan-ba-dinh-ha-noi/120667212.htm,"Phố Đội Cấn, Phường Đội Cấn, Quận Ba Đình, Hà Nội","6,15 tỷ","111,82 triệu/m²",4 phòng,,4,Đã có sổ,"Nhà ngõ, hẻm",,,,55 m²,,Nội thất đầy đủ
https://www.nhatot.com/mua-ban-nha-dat-quan-ba-dinh-ha-noi/120667202.htm,"Phố Đội Cấn, Phường Đội Cấn, Quận Ba Đình, Hà Nội","7,37 tỷ","184,25 triệu/m²",3 phòng,4 phòng,5,Đã có sổ,"Nhà ngõ, hẻm",4 m,10 m,40 m²,40 m²,,Nội thất cao cấp
https://www.nhatot.com/mua-ban-nha-dat-quan-tay-ho-ha-noi/120352453.htm#px=SR-special_display_ad-[PO-3][PL-default],"Phố Võng Thị, Phường Bưởi, Quận Tây Hồ, Hà Nội","5,9 tỷ","168,57 triệu/m²",3 phòng,,,Đã có sổ,"Nhà ngõ, hẻm",,,,35 m²,,
https://www.nhatot.com/mua-ban-nha-dat-quan-tay-ho-ha-noi/120667066.htm,"Phố An Dương, Phường Yên Phụ, Quận Tây Hồ, Hà Nội","2,799 tỷ","93,33 triệu/m²",2 phòng,2 phòng,2,Đã có sổ,"Nhà ngõ, hẻm",,,,30 m²,,Nội thất cao cấp
https://www.nhatot.com/mua-ban-nha-dat-quan-ba-dinh-ha-noi/119491207.htm,"Phố Phạm Hồng Thái, Phường Trúc Bạch, Quận Ba Đình, Hà Nội",31 tỷ,"596,15 triệu/m²",nhiều hơn 10 phòng,,8,Đã có sổ,"Nhà mặt phố, mặt tiền",4 m,,400 m²,52 m²,,Nội thất đầy đủ
https://www.nhatot.com/mua-ban-nha-dat-quan-tay-ho-ha-noi/120666921.htm#px=SR-special_display_ad-[PO-6][PL-default],"Đường Yên Phụ, Phường Yên Phụ, Quận Tây Hồ, Hà Nội",35 tỷ,"466,67 triệu/m²",6 phòng,4 phòng,4,Đã có sổ,"Nhà mặt phố, mặt tiền",4 m,,280 m²,75 m²,,Nội thất đầy đủ
https://www.nhatot.com/mua-ban-nha-dat-quan-thanh-xuan-ha-noi/120666859.htm,"Cù Chính Lan , Phường Khương Mai, Quận Thanh Xuân, Hà Nội","7,3 tỷ","208,57 triệu/m²",2 phòng,3 phòng,4,Đã có sổ,"Nhà ngõ, hẻm",,,,35 m²,,Nội thất đầy đủ
https://www.nhatot.com/mua-ban-nha-dat-quan-ha-dong-ha-noi/120247075.htm,"Lê Trọng Tấn, Phường La Khê, Quận Hà Đông, Hà Nội","8,3 tỷ","207,50 triệu/m²",4 phòng,4 phòng,5,Đã có sổ,"Nhà ngõ, hẻm",3.3 m,,40 m²,40 m²,,Nội thất đầy đủ
https://www.nhatot.com/mua-ban-nha-dat-quan-ha-dong-ha-noi/120370447.htm,"Phố Hà Trì, Phường Hà Cầu, Quận Hà Đông, Hà Nội","6,75 tỷ","156,98 triệu/m²",4 phòng,3 phòng,3,Đã có sổ,"Nhà ngõ, hẻm",,,43 m²,43 m²,,Nội thất đầy đủ
https://www.nhatot.com/mua-ban-nha-dat-quan-ha-dong-ha-noi/120666744.htm,"Phố Phú Lương, Phường Phú Lương, Quận Hà Đông, Hà Nội","6,5 tỷ","190,06 triệu/m²",3 phòng,,,Đã có sổ,"Nhà mặt phố, mặt tiền",,,,34.2 m²,,
https://www.nhatot.com/mua-ban-nha-dat-quan-ha-dong-ha-noi/120370015.htm,"Phố Hà Trì, Phường Hà Cầu, Quận Hà Đông, Hà Nội","4,9 tỷ","132,43 triệu/m²",3 phòng,3 phòng,3,Đã có sổ,"Nhà ngõ, hẻm",3 m,,37 m²,37 m²,,Nội thất đầy đủ
https://www.nhatot.com/mua-ban-nha-dat-quan-ha-dong-ha-noi/120332487.htm,"Phố Mậu Lương, Phường Kiến Hưng, Quận Hà Đông, Hà Nội","6,4 tỷ","164,10 triệu/m²",3 phòng,4 phòng,5,Đã có sổ,"Nhà ngõ, hẻm",,,39 m²,39 m²,,Nội thất cao cấp
https://www.nhatot.com/mua-ban-nha-dat-quan-tay-ho-ha-noi/120666688.htm,"Phố Phú Xá, Phường Phú Thượng, Quận Tây Hồ, Hà Nội","9,9 tỷ","210,64 triệu/m²",4 phòng,,,Đã có sổ,"Nhà ngõ, hẻm",,,,47 m²,,
https://www.nhatot.com/mua-ban-nha-dat-quan-tay-ho-ha-noi/120487966.htm,"Đường Lạc Long Quân, Phường Xuân La, Quận Tây Hồ, Hà Nội","4,75 tỷ","118,75 triệu/m²",3 phòng,3 phòng,3,Đã có sổ,"Nhà ngõ, hẻm",4 m,10 m,40 m²,40 m²,Đông Nam,Hoàn thiện cơ bản
https://www.nhatot.com/mua-ban-nha-dat-quan-ha-dong-ha-noi/120022377.htm,"Phố Trần Đăng Ninh, Phường Phú La, Quận Hà Đông, Hà Nội","11,8 tỷ","357,58 triệu/m²",4 phòng,4 phòng,5,Đã có sổ,"Nhà mặt phố, mặt tiền",303 m,,33 m²,33 m²,,Nội thất đầy đủ
https://www.nhatot.com/mua-ban-nha-dat-quan-tay-ho-ha-noi/120666580.htm#px=SR-special_display_ad-[PO-16][PL-default],"Đường Thụy Khuê, Phường Thụy Khuê, Quận Tây Hồ, Hà Nội",31 tỷ,"476,92 triệu/m²",nhiều hơn 10 phòng,Nhiều hơn 6 phòng,8,Đã có sổ,"Nhà mặt phố, mặt tiền",5 m,,560 m²,65 m²,,Nội thất đầy đủ
https://www.nhatot.com/mua-ban-nha-dat-quan-hai-ba-trung-ha-noi/120666550.htm,"lĩnh nam, Phường Vĩnh Tuy, Quận Hai Bà Trưng, Hà Nội","1,85 tỷ","61,67 triệu/m²",2 phòng,2 phòng,2,Sổ chung / công chứng vi bằng,"Nhà ngõ, hẻm",5 m,6 m,30 m²,30 m²,,
https://www.nhatot.com/mua-ban-nha-dat-quan-tay-ho-ha-noi/120666524.htm,"Phố Phú Xá, Phường Phú Thượng, Quận Tây Hồ, Hà Nội","6,6 tỷ","129,41 triệu/m²",3 phòng,,,Đã có sổ,"Nhà ngõ, hẻm",,,,51 m²,,
https://www.nhatot.com/mua-ban-nha-dat-quan-hoang-mai-ha-noi/120666521.htm,"NGUYỄN ĐỨC CẢNH, Phường Tương Mai, Quận Hoàng Mai, Hà Nội","2,3 tỷ",115 triệu/m²,2 phòng,2 phòng,4,Giấy tờ viết tay,"Nhà ngõ, hẻm",4 m,,,20 m²,,Hoàn thiện cơ bản
https://www.nhatot.com/mua-ban-nha-dat-huyen-hoai-duc-ha-noi/120666363.htm,"Đường Di Trạch, Xã Di Trạch, Huyện Hoài Đức, Hà Nội","3,9 tỷ",78 triệu/m²,3 phòng,3 phòng,3,Đã có sổ,"Nhà ngõ, hẻm",4 m,12 m,50 m²,50 m²,,Nội thất đầy đủ
https://www.nhatot.com/mua-ban-nha-dat-quan-ha-dong-ha-noi/120666347.htm,"cầu mai lĩnh - quốc lộ 6, Phường Yên Nghĩa, Quận Hà Đông, Hà Nội","2,78 tỷ","79,43 triệu/m²",3 phòng,,,Đã có sổ,"Nhà ngõ, hẻm",,,,35 m²,,
https://www.nhatot.com/mua-ban-nha-dat-quan-ba-dinh-ha-noi/120666216.htm,"89, Phố Phan Kế Bính, Phường Cống Vị, Quận Ba Đình, Hà Nội",7 tỷ,140 triệu/m²,6 phòng,4 phòng,5,Đã có sổ,"Nhà ngõ, hẻm",,,,50 m²,,
https://www.nhatot.com/mua-ban-nha-dat-quan-ha-dong-ha-noi/120666142.htm,"Đường Quốc lộ 6 mở rộng (Ba La - Xuân Mai), Phường Yên Nghĩa, Quận Hà Đông, Hà Nội","3,35 tỷ","111,67 triệu/m²",3 phòng,,,Đã có sổ,"Nhà ngõ, hẻm",,,,30 m²,,
https://www.nhatot.com/mua-ban-nha-dat-quan-hoang-mai-ha-noi/116603641.htm,"TÂN KHAI, Phường Vĩnh Hưng, Quận Hoàng Mai, Hà Nội","1,6 tỷ",50 triệu/m²,2 phòng,2 phòng,2,Không có sổ,"Nhà ngõ, hẻm",4 m,,,32 m²,,Nội thất đầy đủ
https://www.nhatot.com/mua-ban-nha-dat-quan-bac-tu-liem-ha-noi/120666102.htm,"Đường Xuân Đỉnh, Phường Xuân Đỉnh, Quận Bắc Từ Liêm, Hà Nội","6,6 tỷ","188,57 triệu/m²",3 phòng,4 phòng,5,Đã có sổ,"Nhà ngõ, hẻm",,,150 m²,35 m²,,Nội thất đầy đủ
https://www.nhatot.com/mua-ban-nha-dat-quan-hoang-mai-ha-noi/119371070.htm,"ĐỊNH CÔNG, Phường Định Công, Quận Hoàng Mai, Hà Nội","3,5 tỷ","85,37 triệu/m²",6 phòng,4 phòng,4,Giấy tờ viết tay,"Nhà ngõ, hẻm",4 m,,,41 m²,,Nội thất cao cấp
https://www.nhatot.com/mua-ban-nha-dat-quan-hoang-mai-ha-noi/120230657.htm,"ĐÔNG THIÊN, Phường Lĩnh Nam, Quận Hoàng Mai, Hà Nội","3,66 tỷ","81,33 triệu/m²",3 phòng,3 phòng,3,Không có sổ,"Nhà ngõ, hẻm",4 m,,,45 m²,,Nội thất cao cấp
https://www.nhatot.com/mua-ban-nha-dat-quan-cau-giay-ha-noi/120665880.htm#px=SR-special_display_ad-[PO-8][PL-default],"Đường Hồ Tùng Mậu, Phường Mai Dịch, Quận Cầu Giấy, Hà Nội","13,2 tỷ","235,71 triệu/m²",4 phòng,,6,Đã có sổ,"Nhà mặt phố, mặt tiền",,,,56 m²,,Nội thất đầy đủ
https://www.nhatot.com/mua-ban-nha-dat-quan-hoang-mai-ha-noi/120615419.htm#px=SR-special_display_ad-[PO-9][PL-default],"Đường Trương Định, Phường Tân Mai, Quận Hoàng Mai, Hà Nội",7 tỷ,"155,56 triệu/m²",7 phòng,,,Đã có sổ,"Nhà ngõ, hẻm",,,,45 m²,,
https://www.nhatot.com/mua-ban-nha-dat-quan-thanh-xuan-ha-noi/120665798.htm,"Khương Đinh, Phường Khương Đình, Quận Thanh Xuân, Hà Nội","6,95 tỷ","198,57 triệu/m²",5 phòng,,,Đã có sổ,"Nhà ngõ, hẻm",3.8 m,,198 m²,35 m²,,
https://www.nhatot.com/mua-ban-nha-dat-quan-cau-giay-ha-noi/120665783.htm,"Ngõ 79 Cầu Giấy, Phường Yên Hoà, Quận Cầu Giấy, Hà Nội","6,9 tỷ","202,94 triệu/m²",3 phòng,4 phòng,5,Đã có sổ,"Nhà ngõ, hẻm",3.5 m,9 m,30 m²,34 m²,,Nội thất đầy đủ
https://www.nhatot.com/mua-ban-nha-dat-quan-ha-dong-ha-noi/120665699.htm,"Đường 19 Tháng 5, Phường Văn Quán, Quận Hà Đông, Hà Nội",6 tỷ,200 triệu/m²,3 phòng,,,Đã có sổ,"Nhà ngõ, hẻm",,,,30 m²,,
https://www.nhatot.com/mua-ban-nha-dat-quan-long-bien-ha-noi/120539701.htm,"Phố Ngọc Lâm, Phường Ngọc Lâm, Quận Long Biên, Hà Nội","7,45 tỷ","169,32 triệu/m²",4 phòng,,,Đã có sổ,"Nhà ngõ, hẻm",,,200 m²,44 m²,,
https://www.nhatot.com/mua-ban-nha-dat-quan-long-bien-ha-noi/120411461.htm,"Đường Nguyễn Văn Cừ, Phường Ngọc Lâm, Quận Long Biên, Hà Nội","6,3 tỷ","170,27 triệu/m²",5 phòng,,,Đã có sổ,"Nhà ngõ, hẻm",,,180 m²,37 m²,,
https://www.nhatot.com/mua-ban-nha-dat-quan-bac-tu-liem-ha-noi/120546746.htm#px=SR-special_display_ad-[PO-15][PL-default],"Đường Phú Diễn, Phường Phú Diễn, Quận Bắc Từ Liêm, Hà Nội","11,8 tỷ","327,78 triệu/m²",4 phòng,5 phòng,7,Đã có sổ,"Nhà mặt phố, mặt tiền",,,36 m²,36 m²,,Nội thất cao cấp
https://www.nhatot.com/mua-ban-nha-dat-quan-tay-ho-ha-noi/120665577.htm,"Đường An Dương Vương, Phường Phú Thượng, Quận Tây Hồ, Hà Nội",6 tỷ,150 triệu/m²,5 phòng,,5,Đã có sổ,"Nhà ngõ, hẻm",,,,40 m²,,
https://www.nhatot.com/mua-ban-nha-dat-quan-ha-dong-ha-noi/120665569.htm,"M39 ngõ 1, Khu tập thể nhà máy A40, Phường Mộ Lao, Quận Hà Đông, Hà Nội","7,5 tỷ","131,58 triệu/m²",8 phòng,Nhiều hơn 6 phòng,5,Đang chờ sổ,"Nhà mặt phố, mặt tiền",398 m,1430 m,57 m²,57 m²,Đông Nam,Nội thất đầy đủ
https://www.nhatot.com/mua-ban-nha-dat-quan-thanh-xuan-ha-noi/120665484.htm,"Lê Trọng Tấn, Phường Khương Mai, Quận Thanh Xuân, Hà Nội","12,5 tỷ","240,38 triệu/m²",4 phòng,,5,Đã có sổ,"Nhà mặt phố, mặt tiền",,,,52 m²,,
https://www.nhatot.com/mua-ban-nha-dat-quan-hai-ba-trung-ha-noi/120665256.htm,"Minh Khai, Phường Minh Khai, Quận Hai Bà Trưng, Hà Nội","7,8 tỷ","236,36 triệu/m²",3 phòng,3 phòng,5,Đã có sổ,"Nhà ngõ, hẻm",5 m,6.6 m,33 m²,33 m²,,Nội thất cao cấp
https://www.nhatot.com/mua-ban-nha-dat-quan-dong-da-ha-noi/120588820.htm,"Phố Thái Hà, Phường Trung Liệt, Quận Đống Đa, Hà Nội","9,5 tỷ",190 triệu/m²,4 phòng,3 phòng,5,Đã có sổ,"Nhà ngõ, hẻm",,,,50 m²,,Nội thất đầy đủ
https://www.nhatot.com/mua-ban-nha-dat-quan-cau-giay-ha-noi/120665244.htm,"Đường Lê Đức Thọ, Phường Mai Dịch, Quận Cầu Giấy, Hà Nội","12,3 tỷ","236,54 triệu/m²",4 phòng,3 phòng,,Đã có sổ,"Nhà ngõ, hẻm",,,,52 m²,,
https://www.nhatot.com/mua-ban-nha-dat-quan-nam-tu-liem-ha-noi/120665109.htm,"Hàm Nghi , Phường Mỹ Đình 1, Quận Nam Từ Liêm, Hà Nội","11,2 tỷ","266,67 triệu/m²",6 phòng,5 phòng,5,Đã có sổ,"Nhà ngõ, hẻm",4.2 m,10 m,42 m²,42 m²,,Nội thất đầy đủ
https://www.nhatot.com/mua-ban-nha-dat-quan-long-bien-ha-noi/119896796.htm,"Đường Phúc Lợi, Phường Long Biên, Quận Long Biên, Hà Nội","4,98 tỷ","160,65 triệu/m²",3 phòng,4 phòng,5,Đã có sổ,"Nhà ngõ, hẻm",4.5 m,7 m,31 m²,31 m²,,Nội thất đầy đủ
https://www.nhatot.com/mua-ban-nha-dat-quan-dong-da-ha-noi/120664966.htm,"Phố Thái Hà, Phường Láng Hạ, Quận Đống Đa, Hà Nội",57 tỷ,"422,22 triệu/m²",3 phòng,,,Đã có sổ,"Nhà mặt phố, mặt tiền",,,,135 m²,,
https://www.nhatot.com/mua-ban-nha-dat-quan-bac-tu-liem-ha-noi/120664921.htm,"Ngõ 241 Đường Liên Mạc, Phường Liên Mạc, Quận Bắc Từ Liêm, Hà Nội","5,45 tỷ","155,71 triệu/m²",4 phòng,4 phòng,5,Đã có sổ,"Nhà mặt phố, mặt tiền",,,,35 m²,,Nội thất đầy đủ
https://www.nhatot.com/mua-ban-nha-dat-quan-long-bien-ha-noi/119992290.htm,"Đường Phúc Lợi, Phường Phúc Lợi, Quận Long Biên, Hà Nội","5,3 tỷ","135,90 triệu/m²",4 phòng,3 phòng,4,Đã có sổ,"Nhà ngõ, hẻm",4 m,9.5 m,,39 m²,,
https://www.nhatot.com/mua-ban-nha-dat-quan-dong-da-ha-noi/119682766.htm,"Văn chương, Phường Văn Chương, Quận Đống Đa, Hà Nội","3,5 tỷ","116,67 triệu/m²",3 phòng,3 phòng,4,Đã có sổ,"Nhà ngõ, hẻm",4 m,7.5 m,120 m²,30 m²,,Nội thất đầy đủ
https://www.nhatot.com/mua-ban-nha-dat-quan-cau-giay-ha-noi/120664822.htm,"Đường Cầu Giấy, Phường Quan Hoa, Quận Cầu Giấy, Hà Nội","6,899 tỷ","197,11 triệu/m²",4 phòng,4 phòng,,Đã có sổ,"Nhà ngõ, hẻm",3.5 m,,35 m²,35 m²,,Nội thất cao cấp
https://www.nhatot.com/mua-ban-nha-dat-quan-hoang-mai-ha-noi/120664745.htm,"Phố Giáp Nhị, Phường Thịnh Liệt, Quận Hoàng Mai, Hà Nội","5,7 tỷ","162,86 triệu/m²",3 phòng,4 phòng,5,Đã có sổ,"Nhà ngõ, hẻm",,,,35 m²,,Nội thất đầy đủ
https://www.nhatot.com/mua-ban-nha-dat-quan-hai-ba-trung-ha-noi/120649268.htm,"Phố Minh Khai, Phường Minh Khai, Quận Hai Bà Trưng, Hà Nội","2,05 tỷ","136,67 triệu/m²",2 phòng,2 phòng,3,Sổ chung / công chứng vi bằng,"Nhà ngõ, hẻm",3 m,5 m,15 m²,15 m²,,
https://www.nhatot.com/mua-ban-nha-dat-quan-hoang-mai-ha-noi/120664703.htm,"Đường Trương Định, Phường Tân Mai, Quận Hoàng Mai, Hà Nội","6,15 tỷ","161,84 triệu/m²",3 phòng,4 phòng,5,Đã có sổ,"Nhà ngõ, hẻm",,,,38 m²,,Nội thất đầy đủ
https://www.nhatot.com/mua-ban-nha-dat-quan-thanh-xuan-ha-noi/120664570.htm,"Đường Giải Phóng, Phường Phương Liệt, Quận Thanh Xuân, Hà Nội",26 tỷ,"346,67 triệu/m²",7 phòng,6 phòng,7,Đã có sổ,"Nhà ngõ, hẻm",7.8 m,9.6 m,75 m²,75 m²,,Nội thất cao cấp
https://www.nhatot.com/mua-ban-nha-dat-quan-long-bien-ha-noi/120664517.htm,"Đường Cổ Linh, Phường Thạch Bàn, Quận Long Biên, Hà Nội","6,7 tỷ","223,33 triệu/m²",4 phòng,,6,Đã có sổ,"Nhà mặt phố, mặt tiền",,,,30 m²,,Nội thất đầy đủ
https://www.nhatot.com/mua-ban-nha-dat-quan-hoan-kiem-ha-noi/116975650.htm,"Sô 5 ngõ 50, Phố Hàng Bạc, Phường Hàng Bạc, Quận Hoàn Kiếm, Hà Nội","8,3 tỷ","237,14 triệu/m²",3 phòng,3 phòng,4,Đang chờ sổ,"Nhà ngõ, hẻm",5 m,7 m,125 m²,35 m²,,Hoàn thiện cơ bản
https://www.nhatot.com/mua-ban-nha-dat-quan-bac-tu-liem-ha-noi/120664431.htm,"Ngõ 70 Phố Văn Trì, Phường Minh Khai, Quận Bắc Từ Liêm, Hà Nội","5,1 tỷ","159,38 triệu/m²",3 phòng,4 phòng,4,Đã có sổ,"Nhà ngõ, hẻm",4 m,8 m,32 m²,32 m²,Tây Nam,Nội thất đầy đủ
https://www.nhatot.com/mua-ban-nha-dat-quan-long-bien-ha-noi/120664342.htm,"Đường Ngô Gia Tự, Phường Long Biên, Quận Long Biên, Hà Nội","18,5 tỷ","137,04 triệu/m²",4 phòng,5 phòng,3,Đã có sổ,Nhà biệt thự,,,135 m²,135 m²,,Nội thất cao cấp
https://www.nhatot.com/mua-ban-nha-dat-quan-nam-tu-liem-ha-noi/120664207.htm,"Phố Phú Đô, Phường Phú Đô, Quận Nam Từ Liêm, Hà Nội","8,9 tỷ","185,42 triệu/m²",4 phòng,4 phòng,,Đã có sổ,"Nhà ngõ, hẻm",,,,48 m²,,
https://www.nhatot.com/mua-ban-nha-dat-quan-cau-giay-ha-noi/120664172.htm,"Ngõ 79 Cầu Giấy, Phường Yên Hoà, Quận Cầu Giấy, Hà Nội","14,6 tỷ","235,48 triệu/m²",4 phòng,,,Đã có sổ,"Nhà ngõ, hẻm",,,,62 m²,,Nội thất đầy đủ
https://www.nhatot.com/mua-ban-nha-dat-quan-thanh-xuan-ha-noi/120664121.htm,"Đường Nguyễn Trãi, Phường Thanh Xuân Trung, Quận Thanh Xuân, Hà Nội","6,4 tỷ",160 triệu/m²,6 phòng,5 phòng,5,Đã có sổ,"Nhà ngõ, hẻm",4 m,10 m,200 m²,40 m²,,Nội thất cao cấp
https://www.nhatot.com/mua-ban-nha-dat-quan-hoang-mai-ha-noi/120622939.htm,"Đường Trương Định, Phường Tân Mai, Quận Hoàng Mai, Hà Nội","5,75 tỷ","191,67 triệu/m²",3 phòng,,,Đã có sổ,"Nhà ngõ, hẻm",,,,30 m²,,
https://www.nhatot.com/mua-ban-nha-dat-quan-dong-da-ha-noi/120664110.htm,"Phố Đặng Tiến Đông, Phường Trung Liệt, Quận Đống Đa, Hà Nội","10,8 tỷ",225 triệu/m²,4 phòng,,5,Đã có sổ,"Nhà ngõ, hẻm",,,48 m²,48 m²,,Nội thất đầy đủ
https://www.nhatot.com/mua-ban-nha-dat-quan-thanh-xuan-ha-noi/120664043.htm,"Đường Trường Chinh, Phường Khương Mai, Quận Thanh Xuân, Hà Nội","7,6 tỷ",190 triệu/m²,5 phòng,4 phòng,4,Đã có sổ,"Nhà ngõ, hẻm",,,,40 m²,,Hoàn thiện cơ bản
https://www.nhatot.com/mua-ban-nha-dat-quan-thanh-xuan-ha-noi/120664000.htm,"Đường Nguyễn Xiển, Phường Thanh Xuân Nam, Quận Thanh Xuân, Hà Nội","5,8 tỷ","96,67 triệu/m²",3 phòng,,,Không có sổ,"Nhà ngõ, hẻm",,,,60 m²,,
https://www.nhatot.com/mua-ban-nha-dat-quan-hoang-mai-ha-noi/120663824.htm,"Phố Định Công Thượng, Phường Định Công, Quận Hoàng Mai, Hà Nội","8,1 tỷ",180 triệu/m²,3 phòng,,,Đã có sổ,Nhà phố liền kề,,,,45 m²,,
