https://www.nhatot.com/mua-ban-nha-dat-quan-hoang-mai-ha-noi/119755071.htm,"Đường Lĩnh Nam, Phường Lĩnh Nam, Quận Hoàng Mai, Hà Nội","8,9 tỷ","222,50 triệu/m²",3 phòng,,,Đã có sổ,"Nhà mặt phố, mặt tiền",,,,40 m²,,
https://www.nhatot.com/mua-ban-nha-dat-quan-thanh-xuan-ha-noi/120607149.htm,"Phố Hoàng Văn Thái, Phường Khương Mai, Quận Thanh Xuân, Hà Nội","6,95 tỷ","165,48 triệu/m²",4 phòng,,,Đã có sổ,"Nhà ngõ, hẻm",,,42 m²,42 m²,,Nội thất đầy đủ
https://www.nhatot.com/mua-ban-nha-dat-quan-hoang-mai-ha-noi/119754834.htm,"Phố Thanh Lân, Phường Thanh Trì, Quận Hoàng Mai, Hà Nội","5,3 tỷ","160,61 triệu/m²",3 phòng,4 phòng,,Đã có sổ,"Nhà ngõ, hẻm",,,,33 m²,,
https://www.nhatot.com/mua-ban-nha-dat-quan-hoang-mai-ha-noi/119732541.htm,"Phố Nam Dư, Phường Lĩnh Nam, Quận Hoàng Mai, Hà Nội","5,2 tỷ","162,50 triệu/m²",3 phòng,4 phòng,5,Đã có sổ,"Nhà ngõ, hẻm",,,,32 m²,,
https://www.nhatot.com/mua-ban-nha-dat-quan-hoang-mai-ha-noi/120150843.htm,"Đường Lĩnh Nam, Phường Lĩnh Nam, Quận Hoàng Mai, Hà Nội","5,65 tỷ","171,21 triệu/m²",3 phòng,4 phòng,,Đã có sổ,"Nhà ngõ, hẻm",,,,33 m²,,
https://www.nhatot.com/mua-ban-nha-dat-quan-ha-dong-ha-noi/120581097.htm#px=SR-special_display_ad-[PO-10][PL-default],"Ngõ 204 Nghĩa Lộ, Phường Yên Nghĩa, Quận Hà Đông, Hà Nội","3,8 tỷ","115,15 triệu/m²",4 phòng,,,Đã có sổ,"Nhà ngõ, hẻm",,,,33 m²,,
https://www.nhatot.com/mua-ban-nha-dat-quan-hoang-mai-ha-noi/120607065.htm,"Đường Lĩnh Nam, Phường Lĩnh Nam, Quận Hoàng Mai, Hà Nội","4,88 tỷ","162,67 triệu/m²",3 phòng,4 phòng,,Đã có sổ,"Nhà ngõ, hẻm",,,,30 m²,,
https://www.nhatot.com/mua-ban-nha-dat-quan-ha-dong-ha-noi/120553701.htm#px=SR-special_display_ad-[PO-12][PL-default],"Đường Quang Trung, Phường La Khê, Quận Hà Đông, Hà Nội","3,95 tỷ","91,86 triệu/m²",2 phòng,,,Đã có sổ,"Nhà ngõ, hẻm",,,,43 m²,,
https://www.nhatot.com/mua-ban-nha-dat-quan-ba-dinh-ha-noi/120607013.htm#px=SR-special_display_ad-[PO-13][PL-default],"Đường Hồng Hà, Phường Phúc Xá, Quận Ba Đình, Hà Nội","17,4 tỷ","322,22 triệu/m²",4 phòng,3 phòng,4,Đã có sổ,"Nhà ngõ, hẻm",3.6 m,,54 m²,54 m²,,
https://www.nhatot.com/mua-ban-nha-dat-quan-hai-ba-trung-ha-noi/120219543.htm,"Phố Minh Khai, Phường Vĩnh Tuy, Quận Hai Bà Trưng, Hà Nội","9,9 tỷ","183,33 triệu/m²",6 phòng,3 phòng,4,Đã có sổ,"Nhà ngõ, hẻm",3.7 m,14.5 m,54 m²,54 m²,Đông Nam,Nội thất cao cấp
https://www.nhatot.com/mua-ban-nha-dat-quan-cau-giay-ha-noi/120606948.htm,"Đường Hoàng Quốc Việt, Phường Nghĩa Đô, Quận Cầu Giấy, Hà Nội",10 tỷ,200 triệu/m²,4 phòng,,,Đã có sổ,"Nhà ngõ, hẻm",,,,50 m²,,
https://www.nhatot.com/mua-ban-nha-dat-quan-hoang-mai-ha-noi/120606935.htm,"số 48 ngách 9 ngõ 521, Đường Trương Định, Phường Tân Mai, Quận Hoàng Mai, Hà Nội","4,65 tỷ",155 triệu/m²,2 phòng,1 phòng,2,Đã có sổ,"Nhà ngõ, hẻm",4.65 m,6.6 m,30 m²,30 m²,,
https://www.nhatot.com/mua-ban-nha-dat-huyen-thanh-tri-ha-noi/120606932.htm,"Đường Phạm Tu, Xã Thanh Liệt, Huyện Thanh Trì, Hà Nội","16,6 tỷ","286,21 triệu/m²",5 phòng,,,Đã có sổ,"Nhà mặt phố, mặt tiền",,,,58 m²,,
https://www.nhatot.com/mua-ban-nha-dat-quan-thanh-xuan-ha-noi/120606925.htm#px=SR-special_display_ad-[PO-18][PL-default],"Phố Phương Liệt, Phường Phương Liệt, Quận Thanh Xuân, Hà Nội",8 tỷ,"133,33 triệu/m²",4 phòng,,,Đã có sổ,"Nhà ngõ, hẻm",,,,60 m²,,
https://www.nhatot.com/mua-ban-nha-dat-quan-ha-dong-ha-noi/120537673.htm#px=SR-special_display_ad-[PO-19][PL-default],"Đường vành đai 4 Hà Nội, Phường Đồng Mai, Quận Hà Đông, Hà Nội","2,8 tỷ","93,33 triệu/m²",4 phòng,,,Đã có sổ,"Nhà ngõ, hẻm",,,,30 m²,,
https://www.nhatot.com/mua-ban-nha-dat-quan-cau-giay-ha-noi/120599575.htm,"Phố Dịch Vọng, Phường Dịch Vọng, Quận Cầu Giấy, Hà Nội","7,8 tỷ","216,67 triệu/m²",6 phòng,4 phòng,5,Đã có sổ,"Nhà ngõ, hẻm",,,,36 m²,,Nội thất cao cấp
https://www.nhatot.com/mua-ban-nha-dat-quan-bac-tu-liem-ha-noi/120606860.htm,"418, Đường Phạm Văn Đồng, Phường Cổ Nhuế 1, Quận Bắc Từ Liêm, Hà Nội","6,3 tỷ","157,50 triệu/m²",3 phòng,3 phòng,5,Đã có sổ,"Nhà ngõ, hẻm",,,,40 m²,,
https://www.nhatot.com/mua-ban-nha-dat-quan-cau-giay-ha-noi/120606751.htm,"Phố Yên Hòa, Phường Yên Hoà, Quận Cầu Giấy, Hà Nội","6,8 tỷ","151,11 triệu/m²",3 phòng,3 phòng,4,Đã có sổ,"Nhà mặt phố, mặt tiền",,,45 m²,45 m²,Nam,Nội thất cao cấp
https://www.nhatot.com/mua-ban-nha-dat-quan-ha-dong-ha-noi/120606739.htm,"ĐƯỜNG LÊ TRỌNG TẤN, Phường La Khê, Quận Hà Đông, Hà Nội","7,8 tỷ","190,24 triệu/m²",4 phòng,,3,Đã có sổ,"Nhà ngõ, hẻm",4.6 m,8.9 m,,41 m²,,
https://www.nhatot.com/mua-ban-nha-dat-huyen-thanh-tri-ha-noi/120606710.htm,"Đường Thanh Liệt, Xã Thanh Liệt, Huyện Thanh Trì, Hà Nội","16,7 tỷ","278,33 triệu/m²",7 phòng,,,Đã có sổ,"Nhà mặt phố, mặt tiền",,,,60 m²,,
https://www.nhatot.com/mua-ban-nha-dat-quan-hai-ba-trung-ha-noi/120606701.htm,"Phố Hồng Mai, Phường Quỳnh Lôi, Quận Hai Bà Trưng, Hà Nội","2,1 tỷ","95,45 triệu/m²",2 phòng,,4,Sổ chung / công chứng vi bằng,"Nhà ngõ, hẻm",4 m,,,22 m²,,
https://www.nhatot.com/mua-ban-nha-dat-quan-thanh-xuan-ha-noi/120606634.htm#px=SR-special_display_ad-[PO-6][PL-default],"Phố Phan Đình Giót, Phường Phương Liệt, Quận Thanh Xuân, Hà Nội","6,53 tỷ","138,94 triệu/m²",3 phòng,,,Đã có sổ,"Nhà ngõ, hẻm",,,,47 m²,,
https://www.nhatot.com/mua-ban-nha-dat-huyen-quoc-oai-ha-noi/118088404.htm,"liên xã, Xã Đại Thành, Huyện Quốc Oai, Hà Nội","2,98 tỷ","72,68 triệu/m²",4 phòng,3 phòng,3,Đã có sổ,Nhà phố liền kề,,,140 m²,41 m²,,Hoàn thiện cơ bản
https://www.nhatot.com/mua-ban-nha-dat-quan-dong-da-ha-noi/120606562.htm,"Phố Hồ Đắc Di, Phường Nam Đồng, Quận Đống Đa, Hà Nội","6,02 tỷ","162,70 triệu/m²",6 phòng,,,Đã có sổ,"Nhà ngõ, hẻm",,,,37 m²,,
https://www.nhatot.com/mua-ban-nha-dat-quan-long-bien-ha-noi/120606554.htm,"Đường Nguyễn Sơn, Phường Gia Thụy, Quận Long Biên, Hà Nội",7 tỷ,"116,67 triệu/m²",2 phòng,,3,Đã có sổ,"Nhà ngõ, hẻm",,,60 m²,60 m²,,
https://www.nhatot.com/mua-ban-nha-dat-huyen-thanh-oai-ha-noi/117780687.htm,"bồi thọ, Xã Cao Viên, Huyện Thanh Oai, Hà Nội","2,08 tỷ","54,74 triệu/m²",3 phòng,,,Đã có sổ,Nhà phố liền kề,,,105 m²,38 m²,,
https://www.nhatot.com/mua-ban-nha-dat-huyen-chuong-my-ha-noi/118063030.htm,"LIÊN XÃ, Xã Phụng Châu, Huyện Chương Mỹ, Hà Nội","2,3 tỷ","60,53 triệu/m²",3 phòng,,3,Đã có sổ,Nhà phố liền kề,,,38 m²,38 m²,,
https://www.nhatot.com/mua-ban-nha-dat-quan-hoan-kiem-ha-noi/89575049.htm,Đường Nguyễn Gia Thiều,350 tỷ,"654,21 triệu/m²",nhiều hơn 10 phòng,Nhiều hơn 6 phòng,,Đã có sổ,"Nhà mặt phố, mặt tiền",20 m,27 m,1600 m²,535 m²,Tây Nam,
https://www.nhatot.com/mua-ban-nha-dat-huyen-quoc-oai-ha-noi/118012715.htm,"liên xã, Xã Đại Thành, Huyện Quốc Oai, Hà Nội","2,95 tỷ","61,46 triệu/m²",3 phòng,,5,Đã có sổ,Nhà phố liền kề,,,150 m²,48 m²,,Hoàn thiện cơ bản
https://www.nhatot.com/mua-ban-nha-dat-quan-ha-dong-ha-noi/120125761.htm,"Đường Quang Trung, Phường Đồng Mai, Quận Hà Đông, Hà Nội","2,78 tỷ","77,22 triệu/m²",3 phòng,3 phòng,4,Đã có sổ,"Nhà ngõ, hẻm",,,36 m²,36 m²,,Hoàn thiện cơ bản
https://www.nhatot.com/mua-ban-nha-dat-quan-dong-da-ha-noi/120606361.htm,"Phố Chùa Bộc, Phường Quang Trung, Quận Đống Đa, Hà Nội","6,7 tỷ","176,32 triệu/m²",3 phòng,,,Đã có sổ,"Nhà ngõ, hẻm",,,,38 m²,,
https://www.nhatot.com/mua-ban-nha-dat-quan-ha-dong-ha-noi/120113913.htm#px=SR-special_display_ad-[PO-16][PL-default],"Phố Giang Lẻ, Phường Biên Giang, Quận Hà Đông, Hà Nội",3 tỷ,100 triệu/m²,3 phòng,,,Đã có sổ,"Nhà ngõ, hẻm",,,,30 m²,,
https://www.nhatot.com/mua-ban-nha-dat-quan-cau-giay-ha-noi/120606282.htm,"Đường Hoàng Quốc Việt, Phường Nghĩa Đô, Quận Cầu Giấy, Hà Nội","7,25 tỷ","131,82 triệu/m²",3 phòng,,4,Đã có sổ,"Nhà ngõ, hẻm",,,,55 m²,,
https://www.nhatot.com/mua-ban-nha-dat-quan-ha-dong-ha-noi/120047507.htm,"yên lộ, Phường Yên Nghĩa, Quận Hà Đông, Hà Nội","3,15 tỷ","98,44 triệu/m²",3 phòng,3 phòng,4,Đã có sổ,"Nhà ngõ, hẻm",,,,32 m²,,
https://www.nhatot.com/mua-ban-nha-dat-huyen-chuong-my-ha-noi/119858250.htm,"Đường Phụng CHâu, Xã Phụng Châu, Huyện Chương Mỹ, Hà Nội","2,5 tỷ","71,43 triệu/m²",3 phòng,,4,Đã có sổ,"Nhà mặt phố, mặt tiền",,,,35 m²,,
https://www.nhatot.com/mua-ban-nha-dat-quan-ba-dinh-ha-noi/120606188.htm,"Phố Đội Cấn, Phường Liễu Giai, Quận Ba Đình, Hà Nội",16 tỷ,200 triệu/m²,nhiều hơn 10 phòng,Nhiều hơn 6 phòng,8,Đã có sổ,"Nhà ngõ, hẻm",5 m,16 m,600 m²,80 m²,,Nội thất cao cấp
https://www.nhatot.com/mua-ban-nha-dat-quan-hai-ba-trung-ha-noi/119759649.htm,"Phố Hồng Mai, Phường Bạch Mai, Quận Hai Bà Trưng, Hà Nội","2,78 tỷ","120,87 triệu/m²",2 phòng,2 phòng,3,Đã có sổ,"Nhà ngõ, hẻm",3.2 m,,23 m²,23 m²,,Hoàn thiện cơ bản
https://www.nhatot.com/mua-ban-nha-dat-quan-thanh-xuan-ha-noi/120606157.htm#px=SR-special_display_ad-[PO-2][PL-default],"Phố Lê Trọng Tấn, Phường Khương Mai, Quận Thanh Xuân, Hà Nội","7,05 tỷ","143,88 triệu/m²",3 phòng,,,Đã có sổ,"Nhà ngõ, hẻm",,,,49 m²,,
https://www.nhatot.com/mua-ban-nha-dat-quan-dong-da-ha-noi/120606146.htm,"Phố Tây Sơn, Phường Trung Liệt, Quận Đống Đa, Hà Nội","6,5 tỷ","209,68 triệu/m²",3 phòng,,,Đã có sổ,"Nhà ngõ, hẻm",,,,31 m²,,
https://www.nhatot.com/mua-ban-nha-dat-quan-hai-ba-trung-ha-noi/120606132.htm,"Phố Thọ Lão, Phường Đồng Nhân, Quận Hai Bà Trưng, Hà Nội","2,48 tỷ",62 triệu/m²,2 phòng,1 phòng,,Đã có sổ,"Nhà ngõ, hẻm",,,,40 m²,,
https://www.nhatot.com/mua-ban-nha-dat-quan-hoang-mai-ha-noi/120606095.htm,"Phố Thanh Đàm, Phường Thanh Trì, Quận Hoàng Mai, Hà Nội","2,1 tỷ",70 triệu/m²,3 phòng,,3,Sổ chung / công chứng vi bằng,"Nhà ngõ, hẻm",3 m,,,30 m²,,
https://www.nhatot.com/mua-ban-nha-dat-quan-hoang-mai-ha-noi/120466844.htm,"Phố Tân Mai, Phường Tân Mai, Quận Hoàng Mai, Hà Nội","2,75 tỷ","68,75 triệu/m²",3 phòng,4 phòng,3,Sổ chung / công chứng vi bằng,"Nhà ngõ, hẻm",,,,40 m²,,Hoàn thiện cơ bản
https://www.nhatot.com/mua-ban-nha-dat-quan-hoang-mai-ha-noi/120605953.htm,"Nam Dư, Phường Lĩnh Nam, Quận Hoàng Mai, Hà Nội","4,98 tỷ","124,50 triệu/m²",4 phòng,3 phòng,4,Đã có sổ,"Nhà ngõ, hẻm",,,,40 m²,,
https://www.nhatot.com/mua-ban-nha-dat-quan-tay-ho-ha-noi/120605948.htm,"Phố Nguyễn Đình Thi, Phường Thụy Khuê, Quận Tây Hồ, Hà Nội","16,5 tỷ","392,86 triệu/m²",6 phòng,6 phòng,6,Đã có sổ,"Nhà ngõ, hẻm",4 m,10 m,42 m²,42 m²,,Nội thất đầy đủ
https://www.nhatot.com/mua-ban-nha-dat-quan-hoang-mai-ha-noi/120059568.htm,"Đường Tam Trinh, Phường Yên Sở, Quận Hoàng Mai, Hà Nội","5,7 tỷ","126,67 triệu/m²",4 phòng,4 phòng,4,Đã có sổ,"Nhà ngõ, hẻm",,,45 m²,45 m²,,Nội thất đầy đủ
https://www.nhatot.com/mua-ban-nha-dat-quan-nam-tu-liem-ha-noi/120605916.htm,Miêu Nha,"4,95 tỷ","137,50 triệu/m²",3 phòng,3 phòng,,Đã có sổ,"Nhà ngõ, hẻm",3.6 m,10 m,36 m²,36 m²,,
https://www.nhatot.com/mua-ban-nha-dat-quan-hoang-mai-ha-noi/119406079.htm,"Phố Vĩnh Hưng, Phường Vĩnh Hưng, Quận Hoàng Mai, Hà Nội","3,68 tỷ","81,78 triệu/m²",3 phòng,,,Không có sổ,"Nhà ngõ, hẻm",,,,45 m²,,
https://www.nhatot.com/mua-ban-nha-dat-quan-bac-tu-liem-ha-noi/120605809.htm,"Đường Xuân Đỉnh, Phường Xuân Đỉnh, Quận Bắc Từ Liêm, Hà Nội","5,3 tỷ","132,50 triệu/m²",2 phòng,,4,Đã có sổ,"Nhà mặt phố, mặt tiền",,,,40 m²,,Nội thất đầy đủ
https://www.nhatot.com/mua-ban-nha-dat-quan-bac-tu-liem-ha-noi/120264309.htm,"Đường Xuân Đỉnh, Phường Xuân Đỉnh, Quận Bắc Từ Liêm, Hà Nội",7 tỷ,175 triệu/m²,3 phòng,,5,Đã có sổ,"Nhà ngõ, hẻm",,,,40 m²,,Nội thất đầy đủ
https://www.nhatot.com/mua-ban-nha-dat-quan-bac-tu-liem-ha-noi/120605733.htm,"Đường Xuân Đỉnh, Phường Xuân Đỉnh, Quận Bắc Từ Liêm, Hà Nội",6 tỷ,"171,43 triệu/m²",3 phòng,,,Đã có sổ,"Nhà mặt phố, mặt tiền",,,,35 m²,,Nội thất đầy đủ
https://www.nhatot.com/mua-ban-nha-dat-quan-hai-ba-trung-ha-noi/120605683.htm,"Ngõ 61 Lạc Trung, Phường Vĩnh Tuy, Quận Hai Bà Trưng, Hà Nội","13,6 tỷ",340 triệu/m²,4 phòng,,4,Đã có sổ,"Nhà ngõ, hẻm",,,,40 m²,,
https://www.nhatot.com/mua-ban-nha-dat-quan-thanh-xuan-ha-noi/120605673.htm,"51, Đường Vũ Trọng Phụng, Phường Thanh Xuân Trung, Quận Thanh Xuân, Hà Nội","8,5 tỷ",170 triệu/m²,2 phòng,3 phòng,3,Đã có sổ,"Nhà ngõ, hẻm",4 m,12.6 m,150 m²,50 m²,,Nội thất đầy đủ
https://www.nhatot.com/mua-ban-nha-dat-huyen-thanh-tri-ha-noi/120605622.htm,"PHỐ TRIỀU KHÚC, Xã Tân Triều, Huyện Thanh Trì, Hà Nội","5,6 tỷ","186,67 triệu/m²",3 phòng,,5,Đã có sổ,"Nhà ngõ, hẻm",5.9 m,5.1 m,,30 m²,,
https://www.nhatot.com/mua-ban-nha-dat-quan-cau-giay-ha-noi/120605595.htm,"Đường Hoàng Quốc Việt, Phường Nghĩa Đô, Quận Cầu Giấy, Hà Nội","9,2 tỷ","191,67 triệu/m²",6 phòng,,6,Đã có sổ,"Nhà ngõ, hẻm",,,,48 m²,,
https://www.nhatot.com/mua-ban-nha-dat-quan-cau-giay-ha-noi/120605546.htm,"Đường Hoàng Quốc Việt, Phường Nghĩa Đô, Quận Cầu Giấy, Hà Nội",13 tỷ,260 triệu/m²,4 phòng,,,Đã có sổ,"Nhà ngõ, hẻm",,,,50 m²,,
https://www.nhatot.com/mua-ban-nha-dat-quan-long-bien-ha-noi/120605537.htm,"Phố Ngọc Lâm, Phường Ngọc Lâm, Quận Long Biên, Hà Nội","13,5 tỷ",270 triệu/m²,4 phòng,4 phòng,4,Đã có sổ,"Nhà ngõ, hẻm",,,50 m²,50 m²,,Nội thất đầy đủ
https://www.nhatot.com/mua-ban-nha-dat-quan-tay-ho-ha-noi/120605497.htm,"Đường Thụy Khuê, Phường Thụy Khuê, Quận Tây Hồ, Hà Nội","5,2 tỷ",208 triệu/m²,3 phòng,4 phòng,5,Đã có sổ,"Nhà ngõ, hẻm",,,,25 m²,,Nội thất đầy đủ
https://www.nhatot.com/mua-ban-nha-dat-huyen-hoai-duc-ha-noi/120605451.htm,"Đường Tỉnh 422B, Xã Vân Canh, Huyện Hoài Đức, Hà Nội","5,5 tỷ","148,65 triệu/m²",4 phòng,4 phòng,5,Đã có sổ,"Nhà mặt phố, mặt tiền",3.2 m,13 m,37 m²,37 m²,Đông Nam,
https://www.nhatot.com/mua-ban-nha-dat-quan-cau-giay-ha-noi/120605441.htm,"Phố Hoa Bằng, Phường Yên Hoà, Quận Cầu Giấy, Hà Nội",33 tỷ,"244,44 triệu/m²",9 phòng,Nhiều hơn 6 phòng,8,Đã có sổ,"Nhà mặt phố, mặt tiền",8 m,,135 m²,135 m²,Đông Nam,
https://www.nhatot.com/mua-ban-nha-dat-quan-dong-da-ha-noi/120605406.htm,"Đường Láng, Phường Láng Hạ, Quận Đống Đa, Hà Nội","9,9 tỷ","170,69 triệu/m²",3 phòng,4 phòng,4,Đã có sổ,"Nhà ngõ, hẻm",5 m,11.6 m,,58 m²,Nam,Nội thất cao cấp
https://www.nhatot.com/mua-ban-nha-dat-quan-thanh-xuan-ha-noi/120605370.htm#px=SR-special_display_ad-[PO-5][PL-default],"Khương Hạ, Phường Khương Trung, Quận Thanh Xuân, Hà Nội","7,1 tỷ","136,54 triệu/m²",4 phòng,,,Đã có sổ,"Nhà ngõ, hẻm",,,,52 m²,,
https://www.nhatot.com/mua-ban-nha-dat-quan-ba-dinh-ha-noi/120482704.htm#px=SR-special_display_ad-[PO-6][PL-default],"Phố Láng Hạ, Phường Thành Công, Quận Ba Đình, Hà Nội",24 tỷ,320 triệu/m²,4 phòng,4 phòng,4,Đã có sổ,Nhà biệt thự,5.5 m,,300 m²,75 m²,,Nội thất cao cấp
https://www.nhatot.com/mua-ban-nha-dat-quan-dong-da-ha-noi/120605319.htm,"Phố Tôn Đức Thắng, Phường Hàng Bột, Quận Đống Đa, Hà Nội",5 tỷ,125 triệu/m²,3 phòng,4 phòng,4,Đã có sổ,"Nhà ngõ, hẻm",,,,40 m²,,Nội thất đầy đủ
https://www.nhatot.com/mua-ban-nha-dat-quan-hoang-mai-ha-noi/120605292.htm,"Đường Trương Định, Phường Tân Mai, Quận Hoàng Mai, Hà Nội",13 tỷ,"166,67 triệu/m²",6 phòng,6 phòng,7,Đã có sổ,"Nhà mặt phố, mặt tiền",5 m,,,78 m²,,Nội thất đầy đủ
https://www.nhatot.com/mua-ban-nha-dat-quan-cau-giay-ha-noi/120605143.htm,"Phố Đông Quan, Phường Quan Hoa, Quận Cầu Giấy, Hà Nội",12 tỷ,"230,77 triệu/m²",5 phòng,6 phòng,6,Đã có sổ,"Nhà ngõ, hẻm",5 m,10 m,300 m²,52 m²,,Nội thất cao cấp
https://www.nhatot.com/mua-ban-nha-dat-quan-bac-tu-liem-ha-noi/120605115.htm,"Đường Nguyễn Đạo An, Phường Phú Diễn, Quận Bắc Từ Liêm, Hà Nội","10,25 tỷ","186,36 triệu/m²",nhiều hơn 10 phòng,Nhiều hơn 6 phòng,7,Đã có sổ,"Nhà ngõ, hẻm",5 m,11 m,55 m²,55 m²,,Nội thất đầy đủ
https://www.nhatot.com/mua-ban-nha-dat-quan-thanh-xuan-ha-noi/119865481.htm,"Phố Bùi Xương Trạch, Phường Khương Đình, Quận Thanh Xuân, Hà Nội",6 tỷ,"181,82 triệu/m²",3 phòng,,,Đã có sổ,"Nhà ngõ, hẻm",,,,33 m²,,
https://www.nhatot.com/mua-ban-nha-dat-quan-cau-giay-ha-noi/119352117.htm#px=SR-special_display_ad-[PO-12][PL-default],"Đường Lạc Long Quân, Phường Nghĩa Đô, Quận Cầu Giấy, Hà Nội","17,5 tỷ","194,44 triệu/m²",nhiều hơn 10 phòng,,,Đã có sổ,"Nhà ngõ, hẻm",,,,90 m²,,Nội thất đầy đủ
https://www.nhatot.com/mua-ban-nha-dat-quan-dong-da-ha-noi/119670054.htm#px=SR-special_display_ad-[PO-13][PL-default],"Phố Thái Thịnh, Phường Trung Liệt, Quận Đống Đa, Hà Nội","18,5 tỷ","174,53 triệu/m²",nhiều hơn 10 phòng,Nhiều hơn 6 phòng,,Đã có sổ,"Nhà ngõ, hẻm",,,,106 m²,,Nội thất đầy đủ
https://www.nhatot.com/mua-ban-nha-dat-quan-thanh-xuan-ha-noi/119595471.htm,"Phố Vũ Tông Phan, Phường Khương Đình, Quận Thanh Xuân, Hà Nội",6 tỷ,"153,85 triệu/m²",4 phòng,,,Đã có sổ,"Nhà ngõ, hẻm",,,,39 m²,,
https://www.nhatot.com/mua-ban-nha-dat-quan-hoang-mai-ha-noi/119526839.htm,"Phố Định Công Thượng, Phường Định Công, Quận Hoàng Mai, Hà Nội",5 tỷ,"131,58 triệu/m²",3 phòng,,,Đã có sổ,"Nhà ngõ, hẻm",,,,38 m²,,
https://www.nhatot.com/mua-ban-nha-dat-quan-cau-giay-ha-noi/120605014.htm,"Đường Phạm Văn Đồng, Phường Mai Dịch, Quận Cầu Giấy, Hà Nội","8,6 tỷ","260,61 triệu/m²",4 phòng,,,Đã có sổ,"Nhà ngõ, hẻm",,,,33 m²,,
https://www.nhatot.com/mua-ban-nha-dat-quan-thanh-xuan-ha-noi/118471951.htm,"Phố Khương Trung, Phường Khương Trung, Quận Thanh Xuân, Hà Nội","6,4 tỷ","156,10 triệu/m²",4 phòng,,4,Đã có sổ,"Nhà ngõ, hẻm",,,,41 m²,,
https://www.nhatot.com/mua-ban-nha-dat-quan-hoang-mai-ha-noi/118914722.htm,"Phố Định Công Thượng, Phường Định Công, Quận Hoàng Mai, Hà Nội",5 tỷ,"142,86 triệu/m²",3 phòng,,,Đã có sổ,"Nhà ngõ, hẻm",,,,35 m²,,
https://www.nhatot.com/mua-ban-nha-dat-quan-thanh-xuan-ha-noi/118643208.htm,"Ngõ 18 Khương Hạ, Phường Khương Đình, Quận Thanh Xuân, Hà Nội",6 tỷ,"166,67 triệu/m²",4 phòng,,4,Đã có sổ,"Nhà ngõ, hẻm",,,,36 m²,,
https://www.nhatot.com/mua-ban-nha-dat-quan-thanh-xuan-ha-noi/118620295.htm,"Phố Hạ Đình, Phường Hạ Đình, Quận Thanh Xuân, Hà Nội",5 tỷ,"128,21 triệu/m²",2 phòng,,3,Đã có sổ,"Nhà ngõ, hẻm",,,,39 m²,,
https://www.nhatot.com/mua-ban-nha-dat-quan-cau-giay-ha-noi/120604969.htm,"Phố Trung Kính, Phường Quan Hoa, Quận Cầu Giấy, Hà Nội","12,5 tỷ","208,33 triệu/m²",2 phòng,2 phòng,2,Đã có sổ,"Nhà ngõ, hẻm",4 m,,60 m²,60 m²,Nam,
https://www.nhatot.com/mua-ban-nha-dat-quan-dong-da-ha-noi/120604894.htm,"Thái Hà, Phường Trung Liệt, Quận Đống Đa, Hà Nội","7,89 tỷ","164,38 triệu/m²",3 phòng,,,Đã có sổ,"Nhà ngõ, hẻm",,,,48 m²,,
https://www.nhatot.com/mua-ban-nha-dat-quan-hai-ba-trung-ha-noi/110459061.htm,"Đường Đại Cồ Việt, Phường Lê Đại Hành, Quận Hai Bà Trưng, Hà Nội","7,6 tỷ",152 triệu/m²,4 phòng,4 phòng,4,Đã có sổ,"Nhà ngõ, hẻm",,,,50 m²,,
https://www.nhatot.com/mua-ban-nha-dat-quan-cau-giay-ha-noi/120604823.htm,"Võ Chí Công, Phường Nghĩa Tân, Quận Cầu Giấy, Hà Nội","11,6 tỷ","150,65 triệu/m²",4 phòng,,4,Đã có sổ,"Nhà mặt phố, mặt tiền",5.1 m,,77 m²,77 m²,,
https://www.nhatot.com/mua-ban-nha-dat-quan-hoang-mai-ha-noi/118548007.htm,"Đường Trương Định, Phường Tương Mai, Quận Hoàng Mai, Hà Nội","10,5 tỷ","190,91 triệu/m²",4 phòng,4 phòng,4,Đã có sổ,"Nhà mặt phố, mặt tiền",,,,55 m²,,
https://www.nhatot.com/mua-ban-nha-dat-quan-hai-ba-trung-ha-noi/119554568.htm,"Phố Nguyễn Đình Chiểu, Phường Lê Đại Hành, Quận Hai Bà Trưng, Hà Nội","8,9 tỷ","234,21 triệu/m²",4 phòng,4 phòng,4,Đã có sổ,"Nhà ngõ, hẻm",,,38 m²,38 m²,,Nội thất đầy đủ
https://www.nhatot.com/mua-ban-nha-dat-quan-hai-ba-trung-ha-noi/107539497.htm,"Đinh Đông, Phường Bạch Mai, Quận Hai Bà Trưng, Hà Nội","6,5 tỷ","135,42 triệu/m²",5 phòng,4 phòng,5,Đã có sổ,"Nhà ngõ, hẻm",4.5 m,,,48 m²,,Nội thất cao cấp
https://www.nhatot.com/mua-ban-nha-dat-quan-hai-ba-trung-ha-noi/119227558.htm,"Phố Yên Lạc, Phường Vĩnh Tuy, Quận Hai Bà Trưng, Hà Nội",25 tỷ,"294,12 triệu/m²",nhiều hơn 10 phòng,Nhiều hơn 6 phòng,8,Đã có sổ,"Nhà mặt phố, mặt tiền",,,85 m²,85 m²,,Nội thất cao cấp
https://www.nhatot.com/mua-ban-nha-dat-quan-hai-ba-trung-ha-noi/117637730.htm,"Phố Minh Khai, Phường Vĩnh Tuy, Quận Hai Bà Trưng, Hà Nội","4,5 tỷ","160,71 triệu/m²",3 phòng,3 phòng,4,Đã có sổ,"Nhà ngõ, hẻm",,,,28 m²,,Nội thất đầy đủ
https://www.nhatot.com/mua-ban-nha-dat-quan-hoang-mai-ha-noi/113819778.htm,"Phố Kim Đồng, Phường Giáp Bát, Quận Hoàng Mai, Hà Nội",18 tỷ,"290,32 triệu/m²",3 phòng,4 phòng,6,Đã có sổ,"Nhà mặt phố, mặt tiền",,,,62 m²,,
https://www.nhatot.com/mua-ban-nha-dat-quan-ha-dong-ha-noi/120604768.htm,"LÝ THƯỜNG KIỆT, Phường Quang Trung, Quận Hà Đông, Hà Nội",12 tỷ,240 triệu/m²,5 phòng,,5,Đã có sổ,"Nhà mặt phố, mặt tiền",4 m,12.5 m,50 m²,50 m²,,Nội thất cao cấp
https://www.nhatot.com/mua-ban-nha-dat-quan-hai-ba-trung-ha-noi/120604748.htm,"Phố Hồng Mai, Phường Bạch Mai, Quận Hai Bà Trưng, Hà Nội","7,6 tỷ","138,18 triệu/m²",2 phòng,2 phòng,,Đã có sổ,"Nhà ngõ, hẻm",,,,55 m²,,
https://www.nhatot.com/mua-ban-nha-dat-huyen-hoai-duc-ha-noi/120604705.htm,"Đồng Nhân, Xã Đông La, Huyện Hoài Đức, Hà Nội","4,05 tỷ","92,05 triệu/m²",4 phòng,4 phòng,4,Đã có sổ,"Nhà ngõ, hẻm",3.5 m,,160 m²,44 m²,,
https://www.nhatot.com/mua-ban-nha-dat-quan-thanh-xuan-ha-noi/120604698.htm,"Phố Lê Trọng Tấn, Phường Khương Mai, Quận Thanh Xuân, Hà Nội","10,9 tỷ","259,52 triệu/m²",4 phòng,5 phòng,5,Đã có sổ,"Nhà ngõ, hẻm",,,42 m²,42 m²,,
https://www.nhatot.com/mua-ban-nha-dat-quan-nam-tu-liem-ha-noi/120604694.htm,"Đường Quang Tiến, Phường Đại Mỗ, Quận Nam Từ Liêm, Hà Nội","5,6 tỷ","186,67 triệu/m²",4 phòng,3 phòng,4,Đã có sổ,"Nhà ngõ, hẻm",3.6 m,,30 m²,30 m²,Đông Nam,Hoàn thiện cơ bản
https://www.nhatot.com/mua-ban-nha-dat-quan-hoang-mai-ha-noi/120604675.htm,"Phố Thįnh Liệt, Phường Thịnh Liệt, Quận Hoàng Mai, Hà Nội","16,5 tỷ","253,85 triệu/m²",4 phòng,,,Đã có sổ,Nhà phố liền kề,,,,65 m²,,
https://www.nhatot.com/mua-ban-nha-dat-quan-thanh-xuan-ha-noi/120604669.htm#px=SR-special_display_ad-[PO-17][PL-default],"Phố Vũ Tông Phan, Phường Khương Trung, Quận Thanh Xuân, Hà Nội","6,7 tỷ",134 triệu/m²,3 phòng,,,Đã có sổ,"Nhà ngõ, hẻm",,,,50 m²,,
https://www.nhatot.com/mua-ban-nha-dat-quan-ha-dong-ha-noi/120041208.htm,"36, Phố Xốm, Phường Phú Lãm, Quận Hà Đông, Hà Nội","3,6 tỷ","112,50 triệu/m²",4 phòng,3 phòng,4,Đã có sổ,"Nhà ngõ, hẻm",,,32 m²,32 m²,Đông,
https://www.nhatot.com/mua-ban-nha-dat-quan-hai-ba-trung-ha-noi/120525188.htm,"Ngõ 34 Vĩnh Tuy, Phường Vĩnh Tuy, Quận Hai Bà Trưng, Hà Nội","5,5 tỷ","171,88 triệu/m²",4 phòng,4 phòng,,Đã có sổ,"Nhà mặt phố, mặt tiền",,,,32 m²,,Hoàn thiện cơ bản
https://www.nhatot.com/mua-ban-nha-dat-quan-nam-tu-liem-ha-noi/120604579.htm,Miêu Nha,"5,6 tỷ",112 triệu/m²,4 phòng,3 phòng,,Đã có sổ,"Nhà ngõ, hẻm",3.6 m,14 m,50 m²,50 m²,,
https://www.nhatot.com/mua-ban-nha-dat-quan-dong-da-ha-noi/120604552.htm,"Phố Tôn Thất Tùng, Phường Khương Thượng, Quận Đống Đa, Hà Nội","6,15 tỷ","170,83 triệu/m²",3 phòng,,,Đã có sổ,"Nhà ngõ, hẻm",,,,36 m²,,
