https://www.nhatot.com/mua-ban-nha-dat-quan-hoang-mai-ha-noi/120207652.htm,"Phố Nguyễn Cảnh Dị, Phường Đại Kim, Quận Hoàng Mai, Hà Nội","20,5 tỷ","284,72 triệu/m²",5 phòng,,,Đã có sổ,"Nhà mặt phố, mặt tiền",,,,72 m²,,
https://www.nhatot.com/mua-ban-nha-dat-quan-ba-dinh-ha-noi/119740170.htm,"Đội cấn, Phường Đội Cấn, Quận Ba Đình, Hà Nội","7,95 tỷ",159 triệu/m²,6 phòng,6 phòng,6,Đã có sổ,"Nhà ngõ, hẻm",5 m,10 m,50 m²,50 m²,,Nội thất đầy đủ
https://www.nhatot.com/mua-ban-nha-dat-quan-hoang-mai-ha-noi/120592642.htm,"Đường Hoàng Mai, Phường Hoàng Văn Thụ, Quận Hoàng Mai, Hà Nội","6,8 tỷ","188,89 triệu/m²",3 phòng,,,Đã có sổ,"Nhà ngõ, hẻm",,,,36 m²,,
https://www.nhatot.com/mua-ban-nha-dat-quan-ba-dinh-ha-noi/120592612.htm,"Phố Đào Tấn, Phường Cống Vị, Quận Ba Đình, Hà Nội","7,2 tỷ","221,54 triệu/m²",3 phòng,3 phòng,6,Đã có sổ,"Nhà ngõ, hẻm",,,,32.5 m²,,
https://www.nhatot.com/mua-ban-nha-dat-quan-long-bien-ha-noi/120538785.htm#px=SR-special_display_ad-[PO-19][PL-default],"Phố Hồng Tiến, Phường Bồ Đề, Quận Long Biên, Hà Nội",16 tỷ,"145,45 triệu/m²",4 phòng,,4,Đã có sổ,"Nhà ngõ, hẻm",6 m,,,110 m²,,
https://www.nhatot.com/mua-ban-nha-dat-quan-ba-dinh-ha-noi/120592555.htm,"Phố Đào Tấn, Phường Cống Vị, Quận Ba Đình, Hà Nội","4,8 tỷ","141,18 triệu/m²",3 phòng,,,Đã có sổ,"Nhà ngõ, hẻm",,,,34 m²,,
https://www.nhatot.com/mua-ban-nha-dat-quan-ba-dinh-ha-noi/120592521.htm,"Phố Đội Cấn, Phường Đội Cấn, Quận Ba Đình, Hà Nội",9 tỷ,"157,89 triệu/m²",3 phòng,2 phòng,3,Đã có sổ,"Nhà ngõ, hẻm",,,57 m²,57 m²,,Hoàn thiện cơ bản
https://www.nhatot.com/mua-ban-nha-dat-quan-dong-da-ha-noi/120053340.htm,"Phố Láng Hạ, Phường Láng Hạ, Quận Đống Đa, Hà Nội",12 tỷ,"285,71 triệu/m²",3 phòng,4 phòng,6,Đã có sổ,"Nhà ngõ, hẻm",4.2 m,,,42 m²,,Nội thất cao cấp
https://www.nhatot.com/mua-ban-nha-dat-quan-thanh-xuan-ha-noi/120592492.htm,"192/4, Phố Lê Trọng Tấn, Phường Khương Mai, Quận Thanh Xuân, Hà Nội","6,5 tỷ","127,45 triệu/m²",5 phòng,3 phòng,4,Đã có sổ,Nhà phố liền kề,,,51 m²,51 m²,,Nội thất đầy đủ
https://www.nhatot.com/mua-ban-nha-dat-quan-cau-giay-ha-noi/120592484.htm,"Ngõ 175 Lạc Long Quân, Phường Nghĩa Đô, Quận Cầu Giấy, Hà Nội","8,5 tỷ","188,89 triệu/m²",3 phòng,4 phòng,5,Đã có sổ,"Nhà ngõ, hẻm",3.5 m,12.86 m,45 m²,45 m²,Tây Bắc,Nội thất cao cấp
https://www.nhatot.com/mua-ban-nha-dat-quan-long-bien-ha-noi/120592428.htm,"Phố Hồng Tiến, Phường Bồ Đề, Quận Long Biên, Hà Nội","26,8 tỷ","595,56 triệu/m²",3 phòng,5 phòng,6,Đã có sổ,"Nhà mặt phố, mặt tiền",6.2 m,,45 m²,45 m²,,Hoàn thiện cơ bản
https://www.nhatot.com/mua-ban-nha-dat-quan-hoang-mai-ha-noi/120592411.htm,"Đường Kim Giang, Phường Đại Kim, Quận Hoàng Mai, Hà Nội","10,3 tỷ","251,22 triệu/m²",2 phòng,,,Đã có sổ,"Nhà ngõ, hẻm",,,37 m²,41 m²,,
https://www.nhatot.com/mua-ban-nha-dat-quan-long-bien-ha-noi/120592395.htm,"Đường Ngọc Thụy, Phường Ngọc Thụy, Quận Long Biên, Hà Nội","12,9 tỷ","131,63 triệu/m²",6 phòng,3 phòng,4,Đã có sổ,"Nhà ngõ, hẻm",,,,98 m²,,
https://www.nhatot.com/mua-ban-nha-dat-quan-ha-dong-ha-noi/120592393.htm#px=SR-special_display_ad-[PO-8][PL-default],"Đường Chiến Thắng, Phường Văn Quán, Quận Hà Đông, Hà Nội","14,5 tỷ","322,22 triệu/m²",4 phòng,3 phòng,5,Đã có sổ,Nhà phố liền kề,4 m,11 m,45 m²,45 m²,,Nội thất cao cấp
https://www.nhatot.com/mua-ban-nha-dat-quan-hai-ba-trung-ha-noi/120592359.htm,"Phố Thể Giao, Phường Lê Đại Hành, Quận Hai Bà Trưng, Hà Nội","15,9 tỷ","378,57 triệu/m²",3 phòng,5 phòng,,Đã có sổ,"Nhà ngõ, hẻm",4 m,,240 m²,42 m²,,Nội thất đầy đủ
https://www.nhatot.com/mua-ban-nha-dat-quan-long-bien-ha-noi/120592326.htm,Đường Lý Sơn,"16,8 tỷ","167,33 triệu/m²",6 phòng,,,Đã có sổ,"Nhà ngõ, hẻm",,,,100.4 m²,,
https://www.nhatot.com/mua-ban-nha-dat-quan-cau-giay-ha-noi/120592318.htm,"Phố Quan Hoa, Phường Quan Hoa, Quận Cầu Giấy, Hà Nội",6 tỷ,"176,47 triệu/m²",3 phòng,,,Đã có sổ,"Nhà ngõ, hẻm",,,,34 m²,,
https://www.nhatot.com/mua-ban-nha-dat-quan-cau-giay-ha-noi/120592274.htm,"Phố Nghĩa Đô, Phường Nghĩa Đô, Quận Cầu Giấy, Hà Nội","14,9 tỷ","338,64 triệu/m²",4 phòng,,6,Đã có sổ,Nhà phố liền kề,,,,44 m²,Nam,Nội thất đầy đủ
https://www.nhatot.com/mua-ban-nha-dat-quan-hoang-mai-ha-noi/120592250.htm,"Phố Tân Mai, Phường Tân Mai, Quận Hoàng Mai, Hà Nội","6,6 tỷ",110 triệu/m²,5 phòng,,,Đã có sổ,"Nhà mặt phố, mặt tiền",,,,60 m²,,Nội thất đầy đủ
https://www.nhatot.com/mua-ban-nha-dat-quan-long-bien-ha-noi/120592168.htm,"Đường Nguyễn Sơn, Phường Bồ Đề, Quận Long Biên, Hà Nội",9 tỷ,200 triệu/m²,3 phòng,4 phòng,5,Đã có sổ,"Nhà ngõ, hẻm",,,,45 m²,,Nội thất đầy đủ
https://www.nhatot.com/mua-ban-nha-dat-quan-dong-da-ha-noi/120592117.htm,"Đường Nguyễn Chí Thanh, Phường Láng Hạ, Quận Đống Đa, Hà Nội","15,5 tỷ","246,03 triệu/m²",2 phòng,,,Đã có sổ,"Nhà ngõ, hẻm",,,,63 m²,,
https://www.nhatot.com/mua-ban-nha-dat-quan-long-bien-ha-noi/118470401.htm#px=SR-special_display_ad-[PO-16][PL-default],"Phố Hồng Tiến, Phường Bồ Đề, Quận Long Biên, Hà Nội","18,5 tỷ","308,33 triệu/m²",4 phòng,,8,Đã có sổ,"Nhà mặt phố, mặt tiền",,,,60 m²,,Nội thất đầy đủ
https://www.nhatot.com/mua-ban-nha-dat-quan-hoang-mai-ha-noi/120591888.htm,"Kin Giang, Phường Thanh Trì, Quận Hoàng Mai, Hà Nội","5,6 tỷ","147,37 triệu/m²",5 phòng,,4,Đã có sổ,"Nhà ngõ, hẻm",,,,38 m²,,Nội thất đầy đủ
https://www.nhatot.com/mua-ban-nha-dat-quan-hoan-kiem-ha-noi/120591879.htm,"Đường Bạch Đằng, Phường Chương Dương, Quận Hoàn Kiếm, Hà Nội","6,9 tỷ","121,05 triệu/m²",4 phòng,3 phòng,3,Đã có sổ,"Nhà ngõ, hẻm",2.5 m,,57 m²,57 m²,,
https://www.nhatot.com/mua-ban-nha-dat-quan-ha-dong-ha-noi/120591862.htm,"Đường Đa Sỹ, Phường Kiến Hưng, Quận Hà Đông, Hà Nội","7,65 tỷ","218,57 triệu/m²",5 phòng,4 phòng,4,Đã có sổ,"Nhà ngõ, hẻm",,,,35 m²,,Nội thất đầy đủ
https://www.nhatot.com/mua-ban-nha-dat-quan-ba-dinh-ha-noi/120514328.htm,"Phố Đội Cấn, Phường Đội Cấn, Quận Ba Đình, Hà Nội","5,3 tỷ","151,43 triệu/m²",3 phòng,4 phòng,5,Đã có sổ,"Nhà ngõ, hẻm",4 m,9 m,175 m²,35 m²,,Nội thất đầy đủ
https://www.nhatot.com/mua-ban-nha-dat-quan-dong-da-ha-noi/113676684.htm,"Thái Thịnh, Phường Thịnh Quang, Quận Đống Đa, Hà Nội","5,71 tỷ","131,26 triệu/m²",5 phòng,,,Đã có sổ,"Nhà ngõ, hẻm",,,,43.5 m²,,
https://www.nhatot.com/mua-ban-nha-dat-quan-dong-da-ha-noi/112102039.htm,"Phố Láng Hạ, Phường Láng Hạ, Quận Đống Đa, Hà Nội","5,8 tỷ","128,89 triệu/m²",4 phòng,,,Đã có sổ,"Nhà ngõ, hẻm",,,,45 m²,,Nội thất cao cấp
https://www.nhatot.com/mua-ban-nha-dat-quan-dong-da-ha-noi/116834321.htm,"Nguyễn Chí Thanh, Phường Láng Thượng, Quận Đống Đa, Hà Nội","5,89 tỷ","130,89 triệu/m²",4 phòng,,5,Đã có sổ,"Nhà ngõ, hẻm",,,,45 m²,,Nội thất đầy đủ
https://www.nhatot.com/mua-ban-nha-dat-quan-dong-da-ha-noi/112930746.htm,"Phố Tây Sơn, Phường Quang Trung, Quận Đống Đa, Hà Nội","5,75 tỷ","151,32 triệu/m²",4 phòng,,5,Đã có sổ,"Nhà ngõ, hẻm",,,,38 m²,,Nội thất cao cấp
https://www.nhatot.com/mua-ban-nha-dat-quan-thanh-xuan-ha-noi/120564615.htm#px=SR-special_display_ad-[PO-5][PL-default],"Phố Bùi Xương Trạch, Phường Khương Đình, Quận Thanh Xuân, Hà Nội","8,86 tỷ","260,59 triệu/m²",3 phòng,4 phòng,6,Đã có sổ,"Nhà ngõ, hẻm",5 m,6 m,,34 m²,,Nội thất đầy đủ
https://www.nhatot.com/mua-ban-nha-dat-quan-dong-da-ha-noi/119741422.htm,"Phố Phương Mai, Phường Phương Mai, Quận Đống Đa, Hà Nội","7,345 tỷ","244,85 triệu/m²",3 phòng,4 phòng,5,Đã có sổ,"Nhà mặt phố, mặt tiền",3 m,,30 m²,30 m²,,Nội thất cao cấp
https://www.nhatot.com/mua-ban-nha-dat-quan-hai-ba-trung-ha-noi/120591570.htm,"Phố Minh Khai, Phường Minh Khai, Quận Hai Bà Trưng, Hà Nội","3,58 tỷ","198,89 triệu/m²",2 phòng,,4,Đã có sổ,"Nhà ngõ, hẻm",,,18 m²,18 m²,,Hoàn thiện cơ bản
https://www.nhatot.com/mua-ban-nha-dat-quan-hoang-mai-ha-noi/120591530.htm,"Phố Nam Dư, Phường Lĩnh Nam, Quận Hoàng Mai, Hà Nội","5,64 tỷ","176,25 triệu/m²",3 phòng,4 phòng,5,Đã có sổ,"Nhà ngõ, hẻm",,,60 m²,32 m²,Đông,Nội thất đầy đủ
https://www.nhatot.com/mua-ban-nha-dat-quan-long-bien-ha-noi/120591493.htm,"Phố Ngọc Lâm, Phường Ngọc Lâm, Quận Long Biên, Hà Nội","7,98 tỷ",190 triệu/m²,6 phòng,4 phòng,5,Đã có sổ,"Nhà ngõ, hẻm",,,,42 m²,,
https://www.nhatot.com/mua-ban-nha-dat-quan-ha-dong-ha-noi/120591437.htm#px=SR-special_display_ad-[PO-10][PL-default],"Phố Trinh Lương, Phường Phú Lương, Quận Hà Đông, Hà Nội","6,05 tỷ",121 triệu/m²,4 phòng,4 phòng,4,Đã có sổ,"Nhà ngõ, hẻm",5.26 m,9.5 m,50 m²,50 m²,,Hoàn thiện cơ bản
https://www.nhatot.com/mua-ban-nha-dat-huyen-thanh-tri-ha-noi/120591431.htm,"Đường Phạm Tu, Xã Thanh Liệt, Huyện Thanh Trì, Hà Nội","16,4 tỷ","287,72 triệu/m²",7 phòng,,,Đã có sổ,"Nhà mặt phố, mặt tiền",,,,57 m²,,
https://www.nhatot.com/mua-ban-nha-dat-quan-hai-ba-trung-ha-noi/120591420.htm,"203, Phố Kim Ngưu, Phường Thanh Lương, Quận Hai Bà Trưng, Hà Nội","8,48 tỷ","229,19 triệu/m²",3 phòng,4 phòng,5,Đã có sổ,"Nhà ngõ, hẻm",,,,37 m²,,Nội thất đầy đủ
https://www.nhatot.com/mua-ban-nha-dat-quan-thanh-xuan-ha-noi/120591378.htm#px=SR-special_display_ad-[PO-13][PL-default],"Đường Nguyễn Trãi, Phường Thanh Xuân Trung, Quận Thanh Xuân, Hà Nội","9,7 tỷ","206,38 triệu/m²",4 phòng,,,Đã có sổ,"Nhà ngõ, hẻm",,,,47 m²,,
https://www.nhatot.com/mua-ban-nha-dat-huyen-thanh-tri-ha-noi/120591350.htm,"Đông Mỹ, Xã Đông Mỹ, Huyện Thanh Trì, Hà Nội","3,85 tỷ","85,56 triệu/m²",3 phòng,2 phòng,3,Đã có sổ,"Nhà ngõ, hẻm",4 m,16 m,48 m²,45 m²,Tây Nam,
https://www.nhatot.com/mua-ban-nha-dat-quan-dong-da-ha-noi/120591324.htm,"Đê La Thành, Phường Ô Chợ Dừa, Quận Đống Đa, Hà Nội","6,3 tỷ",210 triệu/m²,3 phòng,,,Đã có sổ,"Nhà ngõ, hẻm",,,,30 m²,,
https://www.nhatot.com/mua-ban-nha-dat-quan-dong-da-ha-noi/120591320.htm,"Phố Phạm Ngọc Thạch, Phường Kim Liên, Quận Đống Đa, Hà Nội","7,5 tỷ","156,25 triệu/m²",3 phòng,,,Đã có sổ,"Nhà ngõ, hẻm",,,,48 m²,,
https://www.nhatot.com/mua-ban-nha-dat-quan-hai-ba-trung-ha-noi/120591322.htm,"Phố Minh Khai, Phường Minh Khai, Quận Hai Bà Trưng, Hà Nội","17,5 tỷ","437,50 triệu/m²",6 phòng,,,Đã có sổ,"Nhà mặt phố, mặt tiền",,,,40 m²,,Nội thất cao cấp
https://www.nhatot.com/mua-ban-nha-dat-quan-ha-dong-ha-noi/120591283.htm,"An Thắng, Phường Biên Giang, Quận Hà Đông, Hà Nội","3,22 tỷ","97,58 triệu/m²",4 phòng,4 phòng,5,Đã có sổ,"Nhà ngõ, hẻm",4.2 m,8.5 m,33 m²,33 m²,Nam,Nội thất đầy đủ
https://www.nhatot.com/mua-ban-nha-dat-quan-cau-giay-ha-noi/120591214.htm,"Đường Cầu Giấy, Phường Dịch Vọng, Quận Cầu Giấy, Hà Nội",9 tỷ,200 triệu/m²,4 phòng,,,Đã có sổ,"Nhà ngõ, hẻm",,,,45 m²,,
https://www.nhatot.com/mua-ban-nha-dat-quan-ba-dinh-ha-noi/120184735.htm,"Phố Kim Mã, Phường Kim Mã, Quận Ba Đình, Hà Nội","4,9 tỷ",196 triệu/m²,3 phòng,,,Đã có sổ,"Nhà ngõ, hẻm",,,,25 m²,,
https://www.nhatot.com/mua-ban-nha-dat-huyen-thanh-tri-ha-noi/120591092.htm,"Tả Thanh Oai, Xã Tả Thanh Oai, Huyện Thanh Trì, Hà Nội","8,1 tỷ",162 triệu/m²,3 phòng,3 phòng,5,Đang chờ sổ,Nhà phố liền kề,5 m,10 m,50 m²,50 m²,Đông Nam,Nội thất cao cấp
https://www.nhatot.com/mua-ban-nha-dat-quan-dong-da-ha-noi/120591072.htm,"Đường Láng, Phường Láng Thượng, Quận Đống Đa, Hà Nội","6,8 tỷ","178,95 triệu/m²",3 phòng,,,Đã có sổ,"Nhà ngõ, hẻm",,,,38 m²,,
https://www.nhatot.com/mua-ban-nha-dat-quan-bac-tu-liem-ha-noi/120591069.htm,"5, Đường Xuân Đỉnh, Phường Xuân Đỉnh, Quận Bắc Từ Liêm, Hà Nội","6,25 tỷ","183,82 triệu/m²",3 phòng,3 phòng,4,Đã có sổ,"Nhà ngõ, hẻm",3.7 m,9.2 m,34 m²,34 m²,,Nội thất đầy đủ
https://www.nhatot.com/mua-ban-nha-dat-quan-hoang-mai-ha-noi/120591056.htm#px=SR-special_display_ad-[PO-4][PL-default],"Phố Trịnh Đình Cửu, Phường Định Công, Quận Hoàng Mai, Hà Nội","10,5 tỷ","244,19 triệu/m²",6 phòng,,,Đã có sổ,"Nhà ngõ, hẻm",,,,43 m²,,
https://www.nhatot.com/mua-ban-nha-dat-quan-ba-dinh-ha-noi/120591022.htm,"Ngõ 95 Linh Lang, Phường Cống Vị, Quận Ba Đình, Hà Nội",47 tỷ,"313,33 triệu/m²",5 phòng,,,Đã có sổ,"Nhà mặt phố, mặt tiền",,,150 m²,150 m²,,
https://www.nhatot.com/mua-ban-nha-dat-quan-thanh-xuan-ha-noi/120591013.htm,"Phố Vũ Tông Phan, Phường Khương Trung, Quận Thanh Xuân, Hà Nội",13 tỷ,"288,89 triệu/m²",4 phòng,,6,Đã có sổ,"Nhà ngõ, hẻm",4.3 m,,,45 m²,,
https://www.nhatot.com/mua-ban-nha-dat-quan-thanh-xuan-ha-noi/120591003.htm,"Đường Nguyễn Trãi, Phường Thanh Xuân Bắc, Quận Thanh Xuân, Hà Nội","9,7 tỷ","206,38 triệu/m²",4 phòng,,,Đã có sổ,"Nhà mặt phố, mặt tiền",,,47 m²,47 m²,,
https://www.nhatot.com/mua-ban-nha-dat-quan-cau-giay-ha-noi/120590948.htm,"Đường Trần Duy Hưng, Phường Trung Hoà, Quận Cầu Giấy, Hà Nội","9,6 tỷ","171,43 triệu/m²",4 phòng,,,Đã có sổ,"Nhà ngõ, hẻm",,,,56 m²,,
https://www.nhatot.com/mua-ban-nha-dat-quan-hoan-kiem-ha-noi/120590946.htm#px=SR-special_display_ad-[PO-9][PL-default],"Phố Hà Trung, Phường Hàng Bông, Quận Hoàn Kiếm, Hà Nội","49,5 tỷ",990 triệu/m²,2 phòng,2 phòng,2,Đã có sổ,"Nhà mặt phố, mặt tiền",19 m,,100 m²,50 m²,,Nội thất đầy đủ
https://www.nhatot.com/mua-ban-nha-dat-quan-bac-tu-liem-ha-noi/120590922.htm,"Phố Nguyễn Xuân Khoát, Phường Xuân Đỉnh, Quận Bắc Từ Liêm, Hà Nội",6 tỷ,"176,47 triệu/m²",3 phòng,,4,Đã có sổ,"Nhà ngõ, hẻm",4 m,,,34 m²,,
https://www.nhatot.com/mua-ban-nha-dat-quan-nam-tu-liem-ha-noi/120440054.htm,"Số 11 ngách 18 ngõ 17, Đại Mỗ, Phường Đại Mỗ, Quận Nam Từ Liêm, Hà Nội","6,9 tỷ","189,56 triệu/m²",4 phòng,3 phòng,4,Đã có sổ,"Nhà ngõ, hẻm",3.15 m,11.66 m,36.4 m²,36.4 m²,Tây Bắc,Hoàn thiện cơ bản
https://www.nhatot.com/mua-ban-nha-dat-quan-dong-da-ha-noi/119661729.htm,"Vũ thạnh, Phường Khương Thượng, Quận Đống Đa, Hà Nội",25 tỷ,"274,73 triệu/m²",8 phòng,Nhiều hơn 6 phòng,8,Đã có sổ,"Nhà mặt phố, mặt tiền",7 m,,91 m²,91 m²,,Nội thất cao cấp
https://www.nhatot.com/mua-ban-nha-dat-quan-hoang-mai-ha-noi/120542505.htm,"Đường Tam Trinh, Phường Yên Sở, Quận Hoàng Mai, Hà Nội","3,25 tỷ","191,18 triệu/m²",3 phòng,4 phòng,5,Đã có sổ,"Nhà ngõ, hẻm",,,17 m²,17 m²,,Nội thất đầy đủ
https://www.nhatot.com/mua-ban-nha-dat-quan-thanh-xuan-ha-noi/119659997.htm,"Phố Lê Trọng Tấn, Phường Khương Mai, Quận Thanh Xuân, Hà Nội","13,9 tỷ","243,86 triệu/m²",6 phòng,,,Đã có sổ,"Nhà ngõ, hẻm",,,,57 m²,,
https://www.nhatot.com/mua-ban-nha-dat-quan-dong-da-ha-noi/120114648.htm,"Phố Thái Thịnh, Phường Thịnh Quang, Quận Đống Đa, Hà Nội","12,9 tỷ",258 triệu/m²,nhiều hơn 10 phòng,,,Đã có sổ,"Nhà ngõ, hẻm",,,,50 m²,,
https://www.nhatot.com/mua-ban-nha-dat-quan-dong-da-ha-noi/120114752.htm,"Phố Yên Lãng, Phường Thịnh Quang, Quận Đống Đa, Hà Nội","9,9 tỷ","190,38 triệu/m²",1 phòng,,,Đã có sổ,"Nhà ngõ, hẻm",,,,52 m²,,
https://www.nhatot.com/mua-ban-nha-dat-quan-thanh-xuan-ha-noi/119190457.htm,"kim giang, Phường Khương Đình, Quận Thanh Xuân, Hà Nội","14,5 tỷ","273,58 triệu/m²",6 phòng,,,Đã có sổ,"Nhà ngõ, hẻm",,,,53 m²,,
https://www.nhatot.com/mua-ban-nha-dat-quan-tay-ho-ha-noi/120590656.htm,"Phố Nhật Chiêu, Phường Nhật Tân, Quận Tây Hồ, Hà Nội","8,4 tỷ",210 triệu/m²,4 phòng,,,Đã có sổ,"Nhà ngõ, hẻm",,,,40 m²,,
https://www.nhatot.com/mua-ban-nha-dat-quan-ba-dinh-ha-noi/120208410.htm,"Phố Đội Nhân, Phường Vĩnh Phúc, Quận Ba Đình, Hà Nội","17,5 tỷ","354,25 triệu/m²",4 phòng,,,Đã có sổ,"Nhà mặt phố, mặt tiền",,,,49.4 m²,,
https://www.nhatot.com/mua-ban-nha-dat-quan-dong-da-ha-noi/120208333.htm,"Phố Tây Sơn, Phường Quang Trung, Quận Đống Đa, Hà Nội","18,5 tỷ","303,28 triệu/m²",6 phòng,,,Đã có sổ,"Nhà mặt phố, mặt tiền",,,,61 m²,,
https://www.nhatot.com/mua-ban-quan-thanh-xuan-ha-noi/120207909.htm,"Phố Khương Hạ, Phường Khương Đình, Quận Thanh Xuân, Hà Nội","16,5 tỷ","229,17 triệu/m²",4 phòng,,,Đã có sổ,"Nhà mặt phố, mặt tiền",,,,72 m²,,
https://www.nhatot.com/mua-ban-quan-hoang-mai-ha-noi/120590617.htm,"Phố Đại Từ, Phường Đại Kim, Quận Hoàng Mai, Hà Nội","6,05 tỷ","147,56 triệu/m²",4 phòng,,5,Đã có sổ,"Nhà ngõ, hẻm",,,41 m²,41 m²,,
https://www.nhatot.com/mua-ban-quan-dong-da-ha-noi/119166967.htm,"Phố Yên Lãng, Phường Thịnh Quang, Quận Đống Đa, Hà Nội","12,8 tỷ","224,56 triệu/m²",8 phòng,,,Đã có sổ,"Nhà ngõ, hẻm",,,,57 m²,,
https://www.nhatot.com/mua-ban-quan-hai-ba-trung-ha-noi/120590601.htm,"Đường Trương Định, Phường Trương Định, Quận Hai Bà Trưng, Hà Nội","7,6 tỷ",190 triệu/m²,7 phòng,,5,Đã có sổ,"Nhà ngõ, hẻm",4.1 m,,45 m²,40 m²,Tây Bắc,Nội thất đầy đủ
https://www.nhatot.com/mua-ban-quan-ba-dinh-ha-noi/120590561.htm,"Đường Văn Cao, Phường Liễu Giai, Quận Ba Đình, Hà Nội",9 tỷ,"155,17 triệu/m²",3 phòng,3 phòng,4,Đã có sổ,"Nhà ngõ, hẻm",,,58 m²,58 m²,,Nội thất đầy đủ
https://www.nhatot.com/mua-ban-quan-long-bien-ha-noi/120590545.htm,"Phố Sài Đồng, Phường Sài Đồng, Quận Long Biên, Hà Nội","7,1 tỷ",142 triệu/m²,3 phòng,3 phòng,33,Đã có sổ,"Nhà ngõ, hẻm",5 m,,,50 m²,,Hoàn thiện cơ bản
https://www.nhatot.com/mua-ban-quan-ha-dong-ha-noi/120590535.htm,"Đường Chiến Thắng, Phường Văn Quán, Quận Hà Đông, Hà Nội","5,59 tỷ","159,71 triệu/m²",nhiều hơn 10 phòng,,,Đã có sổ,"Nhà ngõ, hẻm",,,,35 m²,,
https://www.nhatot.com/mua-ban-quan-ba-dinh-ha-noi/120590495.htm,"Đường Hoàng Hoa Thám, Phường Vĩnh Phúc, Quận Ba Đình, Hà Nội","17,9 tỷ","331,48 triệu/m²",4 phòng,,,Đã có sổ,"Nhà mặt phố, mặt tiền",,,,54 m²,,
https://www.nhatot.com/mua-ban-quan-long-bien-ha-noi/120590490.htm,"Đường Nguyễn Văn Cừ, Phường Gia Thụy, Quận Long Biên, Hà Nội","6,6 tỷ",150 triệu/m²,4 phòng,,,Đã có sổ,"Nhà ngõ, hẻm",,,270 m²,44 m²,,
https://www.nhatot.com/mua-ban-quan-tay-ho-ha-noi/120105007.htm,"Đường Thụy Khuê, Phường Bưởi, Quận Tây Hồ, Hà Nội","6,2 tỷ","140,91 triệu/m²",4 phòng,4 phòng,6,Đã có sổ,"Nhà mặt phố, mặt tiền",,,44 m²,44 m²,,Nội thất cao cấp
https://www.nhatot.com/mua-ban-quan-nam-tu-liem-ha-noi/120590467.htm,"Phố Đình Thôn, Phường Mỹ Đình 1, Quận Nam Từ Liêm, Hà Nội","7,5 tỷ","166,67 triệu/m²",4 phòng,4 phòng,4,Đã có sổ,"Nhà ngõ, hẻm",,,,45 m²,,Nội thất cao cấp
https://www.nhatot.com/mua-ban-quan-ba-dinh-ha-noi/119824425.htm,"Phố Đội Cấn, Phường Đội Cấn, Quận Ba Đình, Hà Nội","4,8 tỷ","126,32 triệu/m²",3 phòng,3 phòng,5,Đã có sổ,"Nhà mặt phố, mặt tiền",,,38 m²,38 m²,,Nội thất cao cấp
https://www.nhatot.com/mua-ban-quan-ba-dinh-ha-noi/120076917.htm,"Phố Đội Cấn, Phường Đội Cấn, Quận Ba Đình, Hà Nội","6,25 tỷ","156,25 triệu/m²",3 phòng,4 phòng,5,Đã có sổ,"Nhà mặt phố, mặt tiền",,,40 m²,40 m²,,Nội thất cao cấp
https://www.nhatot.com/mua-ban-quan-tay-ho-ha-noi/119231450.htm,"Đường Hoàng Hoa Thám, Phường Thụy Khuê, Quận Tây Hồ, Hà Nội","7,6 tỷ",200 triệu/m²,3 phòng,4 phòng,5,Đã có sổ,"Nhà mặt phố, mặt tiền",,,38 m²,38 m²,,Nội thất cao cấp
https://www.nhatot.com/mua-ban-quan-cau-giay-ha-noi/120590413.htm,"Đường Hoàng Quốc Việt, Phường Nghĩa Đô, Quận Cầu Giấy, Hà Nội","7,5 tỷ","174,42 triệu/m²",4 phòng,,,Đã có sổ,"Nhà ngõ, hẻm",,,,43 m²,,
https://www.nhatot.com/mua-ban-quan-ba-dinh-ha-noi/119070767.htm,"Đường Bưởi, Phường Vĩnh Phúc, Quận Ba Đình, Hà Nội","6,6 tỷ","157,14 triệu/m²",3 phòng,4 phòng,5,Đã có sổ,"Nhà mặt phố, mặt tiền",,,42 m²,42 m²,,Nội thất cao cấp
https://www.nhatot.com/mua-ban-quan-tay-ho-ha-noi/119690792.htm,"Phố Võng Thị, Phường Bưởi, Quận Tây Hồ, Hà Nội","7,2 tỷ","156,52 triệu/m²",3 phòng,4 phòng,6,Đã có sổ,"Nhà mặt phố, mặt tiền",,,46 m²,46 m²,,Nội thất cao cấp
https://www.nhatot.com/mua-ban-quan-ba-dinh-ha-noi/120590381.htm,"Phố Nguyên Hồng, Phường Thành Công, Quận Ba Đình, Hà Nội",4 tỷ,"133,33 triệu/m²",3 phòng,3 phòng,4,Đã có sổ,"Nhà mặt phố, mặt tiền",,,30 m²,30 m²,,Nội thất cao cấp
https://www.nhatot.com/mua-ban-quan-hai-ba-trung-ha-noi/120577840.htm,"Đường Trương Định, Phường Trương Định, Quận Hai Bà Trưng, Hà Nội","6,28 tỷ","179,43 triệu/m²",4 phòng,,5,Đã có sổ,"Nhà ngõ, hẻm",4 m,,35 m²,35 m²,Đông Nam,Nội thất cao cấp
https://www.nhatot.com/mua-ban-quan-hai-ba-trung-ha-noi/120590370.htm,"Phố Minh Khai, Phường Vĩnh Tuy, Quận Hai Bà Trưng, Hà Nội","6,2 tỷ",124 triệu/m²,4 phòng,,4,Đã có sổ,"Nhà ngõ, hẻm",3.5 m,,50 m²,50 m²,,Nội thất đầy đủ
https://www.nhatot.com/mua-ban-nha-dat-quan-thanh-xuan-ha-noi/120521064.htm,"Ngõ 182 Lương Thế Vinh, Phường Thanh Xuân Bắc, Quận Thanh Xuân, Hà Nội","8,68 tỷ","192,89 triệu/m²",4 phòng,5 phòng,5,Đã có sổ,"Nhà ngõ, hẻm",5 m,,45 m²,45 m²,,Nội thất cao cấp
https://www.nhatot.com/mua-ban-nha-dat-quan-bac-tu-liem-ha-noi/120590335.htm,"Phố Hoàng Liên, Phường Thụy Phương, Quận Bắc Từ Liêm, Hà Nội","3,333 tỷ",101 triệu/m²,2 phòng,1 phòng,1,Đã có sổ,"Nhà ngõ, hẻm",3.6 m,,33 m²,33 m²,,Nội thất đầy đủ
https://www.nhatot.com/mua-ban-nha-dat-quan-long-bien-ha-noi/120461922.htm#px=SR-special_display_ad-[PO-3][PL-default],"Phố Bồ Đề, Phường Bồ Đề, Quận Long Biên, Hà Nội","6,35 tỷ","211,67 triệu/m²",3 phòng,,,Đã có sổ,"Nhà ngõ, hẻm",,,150 m²,30 m²,,
https://www.nhatot.com/mua-ban-nha-dat-quan-hoang-mai-ha-noi/120120124.htm#px=SR-special_display_ad-[PO-4][PL-default],"Phố Trần Nguyên Đán, Phường Định Công, Quận Hoàng Mai, Hà Nội","47,6 tỷ","305,13 triệu/m²",6 phòng,Nhiều hơn 6 phòng,8,Đã có sổ,"Nhà mặt phố, mặt tiền",12 m,12.9 m,156 m²,156 m²,,Nội thất cao cấp
https://www.nhatot.com/mua-ban-nha-dat-huyen-thanh-tri-ha-noi/120590291.htm,"Đường Hữu Hoà, Xã Hữu Hoà, Huyện Thanh Trì, Hà Nội","3,9 tỷ","111,43 triệu/m²",4 phòng,3 phòng,5,Đã có sổ,"Nhà ngõ, hẻm",,,35 m²,35 m²,,Nội thất cao cấp
https://www.nhatot.com/mua-ban-nha-dat-quan-hoang-mai-ha-noi/120590255.htm,"Đường Lĩnh Nam, Phường Lĩnh Nam, Quận Hoàng Mai, Hà Nội","6,14 tỷ","170,56 triệu/m²",4 phòng,3 phòng,4,Đã có sổ,"Nhà ngõ, hẻm",4.5 m,,40 m²,36 m²,,Nội thất đầy đủ
https://www.nhatot.com/mua-ban-nha-dat-quan-hai-ba-trung-ha-noi/120590225.htm,"Hòa Bình 2, Phố Minh Khai, Phường Minh Khai, Quận Hai Bà Trưng, Hà Nội","3,89 tỷ","155,60 triệu/m²",3 phòng,3 phòng,4,Đã có sổ,"Nhà ngõ, hẻm",3 m,8 m,26 m²,25 m²,,Nội thất đầy đủ
https://www.nhatot.com/mua-ban-nha-dat-quan-ba-dinh-ha-noi/120590209.htm,"Phố Phan Kế Bính, Phường Cống Vị, Quận Ba Đình, Hà Nội",7 tỷ,"233,33 triệu/m²",3 phòng,,,Đã có sổ,"Nhà ngõ, hẻm",,,,30 m²,,
https://www.nhatot.com/mua-ban-nha-dat-quan-hai-ba-trung-ha-noi/119578988.htm,"Phố Bạch Mai, Phường Bạch Mai, Quận Hai Bà Trưng, Hà Nội","7,1 tỷ","191,89 triệu/m²",4 phòng,3 phòng,5,Đã có sổ,"Nhà ngõ, hẻm",4 m,,37 m²,37 m²,Tây Nam,Nội thất đầy đủ
https://www.nhatot.com/mua-ban-nha-dat-quan-long-bien-ha-noi/120590015.htm,"Đường Phúc Lợi, Phường Phúc Lợi, Quận Long Biên, Hà Nội","4,75 tỷ","135,71 triệu/m²",3 phòng,3 phòng,55,Đã có sổ,"Nhà ngõ, hẻm",3.6 m,,,35 m²,,Hoàn thiện cơ bản
